"No","Judul","Topik","Abstrak","",""
"140","PENYUSUNAN BLUEPRINT INFRASTRUKTUR JARINGAN KOMPUTER MENGGUNAKAN ANALISIS SWOT PADA STMIK LOMBOK","Jaringan Komputer","Perguruan tinggi merupakan institusi yang memiliki elemen cukup kompleks, antar elemen selalu bertukar data, memiliki komunikasi cukup kuat sehingga sangat cocok untuk menerapkan teknologi informasi. Sebagai sebuah perguruan tinggi swasta, STMIK Lombok yang berlokasi di Praya Lombok Tengah juga melakukan pengembangan strategi teknologi informasi.
Untuk menyusun strategi teknologi informasi dari strategi bisnis dalam membangun infrastruktur jaringan komputer diperlukan sebuah analisis strategi dalam penyusunannya. Penyusunan strategi teknologi informasi akan menggunakan analisis SWOT yang akan menganalisis lingkungan internal dan eksternal. Analisis SWOT juga merupakan identifikasi berbagai faktor secara sistematis untuk merumuskan strategi organisasi. Penelitian ini membahas penyusunan Blueprint Infrastruktur Jaringan Komputer menggunakan Analisis SWOT di STMIK Lombok.
Analisis SWOT ini diharapkan mampu memberikan gambaran menyeluruh dalam penyusunan Blueprint Infrastruktur Jaringan Komputer sebagai masukan mengenai kebutuhan kepada stakeholders dalam pembangunan berkelanjutan yang terencana di STMIK Lombok
Kata kunci: Blueprint, analisis SWOT, SI/TI, Infrastruktur, Jaringan Komputer","",""
"141","Proteksi Keamanan Jaringan Komputer di Sekolah Menengah Kejuran Al-Madani Pontianak","Jaringan Komputer","Jaringan komputer berkembang sangatlah pesat. Akses terhadap jaringan komputer terutama internet merupakan kebutuhan yang tidak dapat dihindari. Saat ini, internet tidak hanya digunakan oleh individu, tetapi oleh instansi, organisasi, perguruan tinggi ataupun lembaga pemerintah atau non pemerintah. Karna kebutuhan akses jaringan komputer yang tinggi, maka dibutuhkan keamanan jaringan yang memadai. Keamanan jaringan komputer adalah proses untuk mencegah dan mengidentifikasi penggunaan yang tidak sah dari jaringan komputer. tujuannya adalah untuk mengantisipasi ancaman baik fisik maupun logik yang dapat menganggu aktifitas atau data yang ada dalam sistem yang terdapat dalam jaringan komputer. penelitian ini merupakan penelitian kualitatif deskriptif dengan teknik pengumpulan dan penyusunan data dengan teknik triangulasi. Berdasarkan hasil penelitian, ruangan kepala sekolah dan staff tata usaha di SMK AL-Madani Pontianak telah memiliki jaringan komputer. proteksi keamanan jaringan komputer yang trdapat dalam ruangan tersebut menggunakan antivirus. Selain itu terdapat mikrotik yang digunakan untuk memblok dan juga membatasi beberapa situs yang diatur dan dikendalikan sesuai pihak sekolah. Jaringan Komputer, Proteksi Keamanan","",""
"142","Proxy Server dan Management Bandwidth Jaringan Komputer Menggunakan Mikrotik RB952Ui5ac2nD (Studi Kasus MA Ishla","Jaringan Komputer","Kondisi jaringan yang ada di Madrasah Aliyah Ishlahul Ikhwan Nahdlatul Wathan Mispalah Praya pengelola jaringan saat ini menghadapi beberapa tantangan terkait dengan titik koneksi internet yang ada adalah koneksi bandwidth yang terbatas dan tidak sebanding dengan jumlah pengguna yang ada. Koneksi internet pemanfaatan melalui Local Area Network pada jam belajar, yaitu dari pagi hingga malam. Kebijakan ini berdampak pada keluhan mereka dari guru, siswa dan tidak optimalnya layanan koneksi internet yang ada. Selain tidak adanya keamanan jaringan LAN yang digunakan. Dengan solusi seperti itu maka perlu untuk mengurangi dampak ketidakstabilan koneksi internet di jaringan Madrasah Aliyah Ishlahul Ikhwan Nahdlatul Wathan Mispalah Praya dengan menambahkan Mikrotik RB952Ui5ac2nd yang berfungsi sebagai proxy server, dan manajemen bandwidth.
Tujuan penelitian dilakukan untuk meningkatkan keamanan jaringan LAN di Madrasah Aliyah Ishlahul Ikhwan Nahdlatul Wathan Mispalah Praya dengan menambahkan mikrotik RB952Ui-5ac2nD, memudahkan akses ke Internet dengan menambahkan proxy server, dan melakukan distribusi bandwidth. Metode pengumpulan data yang digunakan adalah metode observasi, wawancara dan studi pustaka. Dari beberapa metode ini akan dilakukan analisis masalah jaringan dan membuat desain yang dibutuhkan, kemudian menguji hasil desain baru. Peralatan yang dibutuhkan adalah Mikrotik RB952U-5ac2nD untuk server proxy dan manajemen bandwidth untuk menghasilkan rancangan sistem blocking, meningkatkan kecepatan akses internet, serta mengoptimalkan penggunaan bandwidth
Kata Kunci : Proxy Server, Bandwidth Management, Mikrotik RB952Ui-5ac2nD","",""
"143","RANCANG BANGUN JARINGAN KOMPUTER POINT TO MULTI POINT PADA RUMAH SAKIT KUSTA DR. RIVAI ABDULLAH PALEMBANG BERBASIS MIKROTIK","Jaringan Komputer","Dunia kesehatan di rumah sakit merupakan salah satu bidang kehidupan yang sarat dengan hal-hal yang menuntut adanya pertukaran informasi secara cepat tepat dan akurat. Gedung administrasi yg berjauhan dengan gedung pelayanan menuntut pertukaran informasi agar kegiatan pelayanan dapat optimal. Penerapan jaringan komputer lokal akan membantu komunikasi serta menghemat investasi peralatan tertentu yang tidak terlalu sering digunakan. Dalam rancang bangun jaringan komputer point to multi point menggunakan peralatan router berbasis MikroTik. Koneksi point to multi point menunjukkan hasil rata-rata waktu tunda dibawah 150ms dengan packet loss 0% sesuai dengan standar ITU-T. Hasil rancang bangun memberikan kemudahan administrator jaringan dalam mengontrol jaringan komputer serta memberikan kenyamanan mengakses data, informasi dan internet bagi pegawai dan karyawan dalam bekerja di lingkungan Rumah Sakit Kusta dr. Rivai Abdullah Palembang. Kata kunci— Jaringan Komputer, Point to multi point, Mikrotik","",""
"144","Rancangan Penerapan Metode Spanning Tree untuk Transmisi Data Pada Jaringan Laboratorium Komputer","Jaringan Komputer","Laboratorium Komputer (Labkomp) Universitas Singaperbangsa Karawang adalah salah satu fasilitas praktikum. Topologi LAN adalah topologi yang digunakan Labkomp untuk berkomunikasi. Karena selain memudahkan komunikasi internal (komunikasi antar komputer dalam pertukaran file dan data), juga dapat memfasilitasi komunikasi eksternal (jaringan internet ke komunikasi pengguna, seperti email, browsing, chatting dan streaming) .Tujuan dari komunikasi ini adalah untuk mendukung proses lab di Labkomp Fasilkom UNSIKA. Labkomp memiliki dua jaringan, Lab. Dasar dan Lab. Melanjutkan pra-praktikum adalah memasang aplikasi untuk mendukung jalannya praktikum. tetapi karena file dan data yang terlalu besar dan sedikit media penyimpanan yang tidak dapat mencadangkan praktikum transfer data terlalu banyak. Metode penelitian adalah Network Development Life Cycle (NDLC). Dengan metode ini bertujuan memiliki fase, tahapan, langkah atau mekanisme proses perancangan jaringan komputer dengan baik. Desain jaringan mendesain Labkomp Fasilkom UNSIKA untuk bergabung dengan Lab. Dasar dan lab. Selanjutnya dengan menggunakan perangkat lunak pelacak paket cisco router tambahan baru dapat dihubungkan. Kemudian desain yang disarankan oleh penulis, aliran data pada jaringan berjalan dengan baik.
Kata Kunci : LAN, NDLC, Spanning Tree, VLAN.","",""
"145","SYSTEM MONITORING PENGIRIMAN DATA PADA JARINGAN KOMPUTER","Jaringan Komputer","Dari hasil dari permasalahan yang fait accompli dalam komunikasi data pada jaringan komputer, seperti pembubaran komunikasi data. Dilakukan penelitian dengan metode penelitian lapangan dan metode penelitian laboratorium. Dari penelitian ini memiliki hasil alat itu bisa monitoring komunikasi data dalam jaringan komputer menggunakan ADC dan Kartu Ethernet. Dengan ini alat komunikasi data dapat diskontinuitas dari awal.
Kata Kunci: Sistem Monitoring, Jaringan Komputer, Komunikasi Data, ADC","",""
"146","SNIFFING PADA JARINGAN WIFI BERBASIS PROTOKOL 802.1X MENGGUNAKAN APLIKASI WIRESHARK","Jaringan Komputer","Dewasa ini teknologi WiFi semakin meningkat seiring kebutuhan masyarakat terhadap akses internet. WiFi merupakan singkatan dari Wireless Fidelity. WiFi dapat dikatakan sebuah teknologi untuk saling bertukar data dengan memanfaatkan gelombang radio (nirkabel) yang dapat digunakan oleh beberapa perangkat elektronik seperti computer, smartphone, tablet, dan sebagainya. Penelitian ini mencoba metode sniffing pada WiFi berbasis protokol 802.1X untuk mendapatkan kode otentikasi client. Kesimpulan yang diperoleh dari penelitian ini adalah Proses Sniifing dengan menggunakan aplikasi Wireshark berhasil mendapatkan kode otentikasi station pada jaringan WiFi berbasis 802.1X. Kode otentikasi dapat digunakan pada saat station tersebut sudah tidak terhubung dengan jaringan WiFi. Hal ini dapat dimanfaat oleh orang lain atau station yang sebenarnya tidak berhak / tidak sah.
Kata kunci: Sniifing, Protokol 802.1X, Wireshark","",""
"147","WORKSHOP SIMULASI JARINGAN DASAR KOMPUTER MENGGUNAKAN CISCO PACKET TRACER","Jaringan Komputer","Pengetahuan akan ilmu komputer saat ini sangat diperlukan terkhusus untuk kalangan pelajar.Salah satunya belajar jaringan komputer yang merupakan ilmu yang banyak dibutuhkan masyarakat.Berhubungan dengan adanya jaringan komputer maka banyak pekerjaan seperti kirim data, cetak kertas ke satu printer oleh banyak computer mudah dilakukan. Namun, pengetahuan akan hal ini sulit di dapat oleh pelajar di sekolah berhubung banyak kendala seperti peralatan yang tidak lengkap, tutor yang berkompeten dibidangnya tida ada, itulah yang dialami oleh siswa SMA Negeri 1 Air Joman Kabupaten Asahan. Maka perlu solusi yang memberikan pengetahuan tersebut.Cisco packet tracer yang merupakan aplikasi gratis yang dapat memberikan gambaran atas jaringan komputer. Dengan aplikasi tersebut maka akan mudah memberikan pengetahuan akan jaringan komputer yang dapat diberikan melalui ceramah, tanya jawab dan praktek. Metode ceramah yang digunakan dimaksudkan untuk memberikan penjelasan secara teori terhadap materi jaringan komputer.Metode praktek digunakan untuk menunjukan langsung cara membuat kabel jaringan dan komunikasi data. Sehinga manfaat yang diperoleh dari kegiatan workshop ini adalah meningkatkan pengetahuan siswa terhadap teknologi jaringan dan siswa mampu membuat koneksi jaringan dengan kabel.
Kata kunci : Jaringan, Komputer, Cisco","",""
"148","RANCANG BANGUN KEAMANAN JARINGAN WIRELESS PADA STIPER SRIWIGAMA PALEMBANG DENGAN RADIUS SERVER","Jaringan Komputer","Jaringan komputer pada STIPER Sriwigama Palembang hanya memanfaatkan jaringan wireless dengan menempatkan Access Point (AP) pada beberapa titik di lingkungan STIPER Sriwigama Palembang. Untuk saat ini, jaringan wireless pada STIPER Sriwigama Palembang tidak memiliki authentication user atau login untuk user yang diperbolehkan mengakses jaringan wireless pada lingkungan STIPER Sriwigama Palembang. Hal ini menyebabkan semua orang yang berada di lingkungan STIPER Sriwigama Palembang dapat mengakses jaringan wireless-nya, sehingga saat dosen, staf maupun mahasiswa STIPER Sriwigama Palembang merasakan kecepatan jaringan wireless yang lambat dan tidak jarang pula mereka tidak mendapatkan jalur akses jaringan wireless dikarenakan oleh user yang sudah sangat ramai. Oleh karena permalahan ini, pada penelitian saat ini akan dirancang bangun radius server dengan memanfaatkan Mikrotik Router Board sebagai media authentication user. Dengan adanya authentication user, maka login user untuk dapat mengakses jaringan wireless pada STIPER Sriwigama Palembang hanya akan dimiliki oleh dosen, staf ataupun mahasiswa STIPER Sriwigama Palembang saja dan masyarakat umum tidak akan bisa terkoneksi ke jaringan wireless STIPER Sriwigama Palembang lagi.
Kata Kunci : Jaringan wireless, Access Point (AP), Authentication, Radius Server, Mikrotik Router Board","",""
"149","READINESS ASSESSMENT PENERAPAN MEDIA PEMBELAJARAN PENGENALAN HARDWARE JARINGAN KOMPUTER BERBASIS AUGMENTED REALITY","Jaringan Komputer","Penelitian bertujuan untuk menganalisis kesiapan mahasiswa dalam penerapan media pembelajaran berbasis augmented reality materi Pengenalan Hardware Jaringan Komputer. Metode penelitian menggunakan survey. Subjek penelitian adalah mahasiswa semester IV Program Studi Pendidikan Teknologi Informasi dan Komputer IKIP PGRI Pontianak. Teknik pengumpulan data menggunakan komunikasi tidak langsung. Alat pengumpul data menggunakan angket. Teknik analisis data menggunakan analisis deskriptif dengan mengadaptasi model Electronic Learning Readiness dari Aydin dan Tasci. Berdasarkan hasil analisis, disimpulkan bahwa: (1) Model ELR Aydin dan Tasci yang diterapkan memberikan hasil kesiapan penerapan media pembelajaran berbasis augmented reality termasuk pada kategori siap, tetapi membutuhkan sedikit peningkatan pada beberapa faktor, dengan skor ELR = 3,63 > 3,4;dan (2) Peningkatan perlu dilakukan pada faktor yang memiliki nilai skor ELR rendah, yaitufaktor manusia dan pengembangan diri yang masing-masing memiliki nilai skor ELR = 3,13 dan = 3,22.
Kata Kunci: analisis kesiapterapan, media pembelajaran, augmented reality.","",""
"150","IMPLEMENTASI MIKROTIK ROUTER BOARD 750 SEBAGAI FIREWALL BLOK SITUS PADA JARINGAN LAN","Jaringan Komputer","Penggunaan internet saat ini semakin meluas, dengan mudah berbagai informasi kita temukan
di internet, mulai dari ilmu pengetahuan, bisnis, komunitas sampai informasi yang menjurus kepada
konten negatifpun sering di jumpai. Tidak semua informasi yang ada di internet positif, tak jarang
informasi negatif banyak ditemukan, bahkan informasi yang berkonten negatif terkadang merugikan
pengguna internet. Untuk bisa terkoneksi ke internet ada banyak layanan internet yang bisa digunakan,
pastinya layanan tersebut sudah terhubung dengan ISP (internet service provider) atau jasa penyedia
layanan internet. Jaringan LAN adalah konsep jenis jaringan yang banyak digunakan dalam
pendistribusian layanan internet. Saat ini pendistribusian layanan internet sudah semakin meluas, mulai
dari instansi pemerintah, perusahaan, sekolah bahkan sampai café untuk sekedar minum kopi pun tak
luput dari layanan internet, untuk itu perlu melakukan filterisasi terhadap situs web yang berkonten
negatif. Dalam penelitian ini penulis menjelaskan bagaimana proses blok situs dengan menggunakan
hardware Mikrotik Routerboar 750 yang digunakan sebagai firewall, yang nantinya dimplementasikan
pada jaringan LAN.
Kata Kunci: Blok Situs Web, Internet, Jaringan LAN, Mikrotik","",""
"151","JARINGAN SYARAF TIRUAN ALGORITMA BACKPROPAGATION DALAM MEMPREDIKSI KETERSEDIAAN KOMODITI PANGAN PROVINSI RIAU","Jaringan Syaraf Tiruan","Sebuah sistem untuk prediksi ketersediaan komoditi pangan dapat membantu dalam menentukan keputusan. Jaringan Syaraf Tiruan merupakan metode yang mampu melakukan proses matematis untuk prediksi kertersediaan komoditi pangan. Dengan algoritma Backpropagation, dilakukan proses pengolahan data terdahulu yang dijadikan input untuk prediksi ketersediaan komoditi pangan. Data yang diolah sebagai variabel input adalah Luas Area Panen, Tingkat Produktivitas, Jumlah Produksi dan Jumlah Kebutuhan Konsumsi. Sementara komoditi pangan yang diolah adalah jenis Padi, Jagung, Kedelai, Kacang Tanah, Kacang Hijau, Ubi Kayu dan Ubi Jalar. Data-data tersebut diambil dari tahun 2006 hingga tahun 2013. Tahun 2006 hingga 2012 dijadikan data input, sementara untuk tahun 2013 dijadikan data target. Beberapa tahapan Backpropagation yaitu dengan inisialisasi bobot, aktivasi, menghitung bobot input dan bias output dan perubahan bobot dan bias. Tahapan tersebut akan diperoleh output yang ingin dicapai dengan pendekatan error terkecil sehingga di peroleh hasil prediksi ketersediaan komoditi pangan. Proses pelatihan menggunakan alat bantu perangkat lunak Matlab 6.1. Hasilnya adalah prediksi jumlah ketersediaan komoditi pangan dengan proses pelatihan dan pengujian menghasilkan actual output sebagai target yang dicapai.
Kata Kunci : Jaringan Syaraf Tiruan, Backpropagation, Prediksi, Komoditi Pangan.","",""
"152","Prediksi Nilai Tukar Petani Menggunakan Jaringan Syaraf Tiruan Backpropagation","Jaringan Syaraf Tiruan","Badan Pusat Statistik (BPS) menggunakan Nilai Tukar Petani (NTP) sebagai salah satu indikator untuk mengukur tingkat kesejahteraan atau kemampuan daya beli petani. Nilai indeks NTP untuk periode yang akan datang perlu di lakukan prediksi yang dapat dimanfaatkan pihak terkait dalam mempersiapkan tindakan-tindakan pencegahan apabila indeks NTP turun dari periode sebelumnya. Paper ini bertujuan untuk mengukur unjuk kerja algoritma jaringan syaraf tiruan Backpropagation dalam memprediksi Nilai Tukar Petani (NTP) Provinsi Jawa Timur satu bulan mendatang. Data yang digunakan yaitu data tahun 2008-2012 untuk proses pelatihan jaringan. Proses pengujian dilakukan dengan membandingkan hasil pengujian dengan data aktual tahun 2013 dan 2014. Hasil pengujian menunjukkan bahwa persentase error terkecil apabila jumlah node lapisan tersembunyi 7 dan nilai laju pembelajaran 0.1 dengan rata-rata error sebesar 0.61% atau tingkat akurasi mencapai 99.39%.
Kata kunci: Prediksi, Nilai Tukar Petani, Backpropagation","",""
"153","PREDIKSI RISIKO KREDIT DENGAN JARINGAN SYARAF TIRUAN BACKPROPAGATION","Jaringan Syaraf Tiruan","Prediksi risiko kredit sangat bermanfaat bagi pihak bank atau lembaga pembiayaan dalam mengambil
keputusan kredit. Pada pengambilan keputusan tersebut lembaga pembiayaan wajib melaksanakan prinsip
kehati-hatian untuk memperkecil risiko dalam pemberian kredit. Pada penelitian ini akan dirancang perangkat
lunak prediksi risiko kredit dengan metode jaringan syaraf tiruan backpropagation. Dari prediksi jaringan
syaraf tiruan backpropagation dengan 1 hidden layer dengan jumlah sel 100 dengan fungsi aktivasi satlin
mampu memprediksi risiko kredit dengan prosentase kebenaran 70%, jaringan syaraf tiruan backpropagation
dengan 2 hidden layer dengan jumlah sel pertama 100 dan sel kedua 300 dengan kombinasi fungsi aktivasi
logsig-satlin mampu memprediksi risiko kredit dengan prosentase kebenaran 100%. Berdasarkan hasil tersebut,
penelitian ini merekomendasikan pengembangan algoritma jaringan syaraf tiruan sebagai metode yang efektif
pada sistem prediksi risiko kredit.
Kata kunci: Prediksi risiko kredit, jaringan syaraf tiruan, backpropagation.","",""
"154","JARINGAN SYARAF TIRUAN UNTUK MEMPREDIKSI KINERJA SATPAM","Jaringan Syaraf Tiruan","Penilaian kinerja karyawan merupakan salah satu hal yang sangat penting dilakukan oleh pihak manajemen Sumber Daya Manusia (SDM) dalam suatu instansi, sebab aspek tersebut menjadi faktor penentu bagi para pengambil kebijakan untuk menaikkan jenjang karier dari para karyawannya atau tidak. Artikel ini menyajikan analisis terhadap penggunaan Multi Layer Perceptron (MLP) untuk memprediksi kinerja Satuan Pengamanan (Satpam) yang telah dididik oleh suatu instansi resmi. Data yang digunakan diperoleh secara langsung dari PT. Garuda Merah Indonesia, yakni lembaga pendidik dan pelatih calon Satpam, sebanyak 175 record dengan 10 atribut yang meliputi penilaian terhadap individu dalam aspek kemampuan kognitif, kepribadian, dan keterampilan. MLP memprediksi kinerja Satpam ke dalam tiga kategori, yakni “Baik”, “Cukup”, dan “Kurang”. Teknik Cross Validation sebanyak 10 fold juga digunakan pada tahap pengujian sistem untuk mengukur performa sistem secara komprehensif dengan keluaran berupa tingkat akurasi terbaik sebesar 97,75%.
Kata Kunci: prediksi kinerja karyawan, jaringan syaraf tiruan, multi layer perceptron, data mining","",""
"155","Metode Baru Untuk Pintu Loker Dengan Sistem Keamanan Wajah Menggunakan Algoritma Backpropagation","Jaringan Syaraf Tiruan","Perkembangan teknologi dewasa ini berkembang sangat pesat, dimana peralatan-peralatan modern diciptakan
untuk mempermudah dan mempercepat suatu proses kerja. Dengan kemajuan inilah energi listrik merupakan
pembantu untuk melakukan proses kerja. Di dalam mempermudah proses kerja biasanya merujuk pada sistem
otomatis pengontrolan, yang salah satunya adalah PLC (Programmable Logic Controller). Dimana PLC dalam
hal ini mampu mengontrol peralatan Building Automation System (BAS) diantaranya yaitu Air Condisioner
(AC), lampu dan stop kontak di suatu ruangan yang disesuaikan pengaturannya melalui setting waktu dalam
pemograman yang telah tersedia di PLC itu sendiri, seperti @ (weekly timer), *0 (calender timer), T (timer).
Khusus untuk AC dan pengontrolannya menggunakan sensor Infra Red yang dapat mendeteksi atau tidaknya
seseorang yang bergerak di daerah pendeteksian sensor tersebut. Dengan adanya PLC sebagai pengontrol
utama peralatan Building automation System (BAS) seluruh sistem di dalam gedung dapat bekerja secara
otomatis dan manual serta mengupayakan agar mempermudah dan memperingan pekerjaan manusia di area
gedung maupun ruangan sekaligus memberikan penghematan dalam hal pemakaian daya listrik.
Kata Kunci : PLC, Pengontor Utama, Automatis, CBASI.","",""
"156","JARINGAN SYARAF TIRUAN BACKPROPAGATION UNTUK PREDIKSI JUMLAH PENGUNJUNG KOLAM RENANG","Jaringan Syaraf Tiruan","Teknik pemecahan masalah untuk memprediksi diantaranya Jaringan Syaraf Tiruan. Jaringan Saraf Tiruan ini menggunakan Arsitektur Multilayer Net yang meliputi 3 unit sel lapisan masukan, satu lapisan tersembunyi dengan jumlah unit sel yang ditentukan secara acak, dan satu lapisan keluaran berjumlah satu unit sel sebagai target. Data yang diambil berupa jumlah pengunjung dengan klasifikasi anak-anak, orang remaja dan orangtua, secara umum jumlah pengujung anak anak lebih banyak dibanding jenis pengunjung lain. JST itu sendiri adalah melakukan suatu proses pembelajaran dari suatu model yang diinginkan berdasarkan data, kemudian JST yang akan melakukan proses untuk mencari atau menemukan dalam pencocokan pola. Selanjutnya data dianalisis dengan menggunakan JST metode Backpropagation, dengan bantuan software MATLAB. Hasil dari proses prediksi dapat digunakan sebagai pembanding dengan data target yang telah ditentukan. Untuk mempermudah perhitungan didesain suatu toolbox Matlab dengan menggunakan GUI Matlab. Dari hasil menunjukkan pembelajaran dengan jst dengan arsitektur 3-2-1 dapt dierapkan untuk memprediksi.
Kata Kunci: Jaringan Syaraf Tiruan (JST), Backpropagation, Prediksi, Pengunjung Kolam Renang","",""
"157","JARINGAN SYARAF TIRUAN UNTUK MEMPREDIKSI NILAI KELULUSAN SIDANG (STUDI KASUS : STMIK KAPUTAMA BINJAI )","Jaringan Syaraf Tiruan","Sidang skripsi merupakan proses yang harus dijalani seorang mahasiswa guna untuk mempertanggung jawabkan skripsi yang telah diperbuat. Nilai sidang skripsi menentukan kelulusan mahasiswa, dan tingkat kelulusan mahasiswa tersebut dijadikan ukuran mutu kampus tersebut. Masalahnya adalah banyak mahasiswa yang tertekan dan takut dalam menghadapi sidang skripsi, tidak sedikit diantara mahasiswa yang stres dalam menghadapai skripsi bahkan ada yang menunda pengerjaan skripsinya sehingga berpengaruh terhadap nilai sidang yang diperoleh. Selain itu terdapat mahasiswa yang memiliki IP bagus tetapi nilai sidang tidak bagus, begitu pula sebaliknya. Metode Backpropagation dipilih karena mampu dalam memprediksi nilai kelulusan sidang skripsi berdasarkan input dari nilai IP dari semester I sampai VII dan nilai sidang. Penelitian dilakukan dengan dua cara, yaitu pelatihan dan pengujian. Proses pelatihan bertujuan untuk mengenali atau mencari hasil yang diharapkan dengan menggunakan banyak pelatihan, sehingga akan menghasilkan mana pola yang terbaik untuk melatih data tersebut. Setelah pelatihan mencapai goal berdasarkan pola yang terbaik maka akan dilakukan pengujian dengan data yang baru untuk melihat keakuratan antara target dengan menggunakan software Matlab R2014a. Berdasarkan hasil pengujian data keseluruhan dengan menggunakan software Matlab R2014a didapat hasil yang konvergen, dengan target error 0.2. Dari hasil pelatihan dan pengujian yang dilakukan diperoleh hasil prediksi nilai kelulusan sidang skripsi dengan nilai prediksi (Recognition Rate) 0,8727. Penelitian ini juga dapat membantu dalam memprediksi nilai kelulusan sidang skripsi mahasiswa STMIK Kaputama Binjai
Kata Kunci : Jaringan Syaraf Tiruan,Backpropagation, Kelulusan Sidang Skripsi.","",""
"158","Model Jaringan Syaraf Tiruan Dalam Memprediksi Ketersediaan Cabai Berdasarkan Provinsi","Jaringan Syaraf Tiruan","Tanaman cabai adalah bumbu masakan yang saling melengkapi. Harga cabai selalu berfluktuasi. Tercatat dari 2012 hingga 2017, produksi tanaman cabai besar (ton) di setiap provinsi berfluktuasi. Pemerintah membutuhkan prediksi ketersediaan tanaman cabai berdasarkan provinsi di Indonesia untuk meningkatkan ketahanan pangan, terutama produksi cabai. Penelitian ini memberikan kontribusi kepada pemerintah untuk dapat memprediksi ketersediaan tanaman cabai berdasarkan provinsi di Indonesia di masa depan. Data yang digunakan adalah data dari Badan Pusat Statistik melalui situs web www.bps.go.id. Data tersebut adalah data tentang ketersediaan tanaman cabai menurut provinsi di Indonesia dari 2012 hingga 2017. Algoritma yang digunakan dalam penelitian ini adalah Jaringan Syaraf Tiruan dengan metode Backpropogation. Variabel input yang digunakan adalah data 2012 (X1), data 2013 (X2), data 2014 (X3), dan data 2015 (X4) dengan 4 pelatihan arsitektur dan model pengujian, 4-2-1, 4-3-1, 4-4-1, dan 4-5-1. Data target diambil dari data 2016 (T). Output yang dihasilkan adalah pola terbaik dari arsitektur JST. Model arsitektur terbaik adalah 4-5-1 dengan zaman 670, MSE 0,010651, dan tingkat akurasi 99,97. Kata Kunci: Backpropogation, JST, Ketersediaan Tanaman Cabai, Prediksi","",""
