"No","Judul","Topik","Abstrak","",""
"210","Perancangan dan Pembuatan Aplikasi Manajemen Publikasi Ilmiah Berbasis Online pada Jurnal SISFO","Rekayasa Perangkat Lunak","Jurusan Sistem Informasi ITS sebagai instansi pendidikan yang berperan sebagai pengelola publikasi ilmiah memiliki ruang lingkup pengelolaan mencakup jurnal SISFO yang diterbitkan tahunan. Proses pengelolaan saat ini belum berbasis aplikasi memungkinkan terjadinya ketidakjelasan cakupan pembagian kerja, sehingga pengelolaan tidak berjalan efisien. Publikasi yang dilakukan saat ini masih melalui media cetak, sehingga belum dapat diakses secara mudah. Berbagai macam permasalahan yang ditemukan dalam pengelolaan jurnal ilmiah saat ini di Jurusan Sistem Informasi menjadi pokok dari dibutuhkannya aplikasi manajemen publikasi ilmiah berbasis online yang mampu mengelola kegiatan publikasi ilmiah untuk menciptakan pengelolaan dan publikasi yang lebih baik dan meningkatkan kemudahan akses.
Perancangan aplikasi dalam penelitian ini dibangun dengan metode Unified Software Development Process dan perancangan aplikasi menggunakan Unified Modeling Languague (UML). Mekanisme pengerjaan penelitian ini dibuat secara iteratif dari proses pembuatan Spesifikasi Kebutuhan Perangkat Lunak (SKPL), kemudian dilanjutkan dengan pembuatan Desain Perancangan Perangkat Lunak (DPPL), kemudian diikuti dengan pembuatan aplikasi dan ditutup dengan pengujian. Proses ini dilakukan terus menerus sesuai dengan jangka waktu perencanaan.
Hasil dari penelitian ini adalah dokumen perancangan dan aplikasi manajemen publikasi ilmiah. Penerapan aplikasi manajemen publikasi ilmiah ini mampu meningkatkan kualitas dari proses pengelolaan jurnal ilmiah di Jurusan Sistem Informasi menjadi lebih sistematis dan terorganisir untuk mencapai efisiensi dan meningkatkan publikasi menjadi global.
Kata Kunci— Manajemen Publikasi Ilmiah, Unified Modeling Languague, Unified Software Development Process.","",""
"211","REKAYASA PERANGKAT LUNAK PADA DATA NASABAH KREDIT PERMAISURI BERBASIS WEB","Rekayasa Perangkat Lunak","Sebagai bagian dari sistem perbankan yang bernaung dibawah pengawasan Otoritas Jasa Keungan
(OJK). Bank Sumut Cabang Rantauprapat harus selalu memberikan berkontribusi maksimal dalam menggerakkan
perekonomian secara keseluruhan. Namun untuk operasional produk pembiayaan pinjaman terkhusus untuk
pinjaman Kredit SSI (Sumut Sejahtera I) atau biasa dikenal dengan pinjaman Permaisuri (Perempuan Mandiri
Suri Tauladan) sistem operasionalnya masih menggunakan sistem komputerisasi manual, dimana sangat
membutuhkan sistem operasional yang dapat bekerja dengan cepat, efektif dan efisien.Maka untuk memberikan
pelayanan dalam menangani nasabah peminjam dengan berbagai sistem pembiayaan tersebut. Bank Sumut
Cabang Rantauprapat membutuhkan sistem operasional yang cepat, efisien, serta memudahkan bagi para
karyawan bank dalam melewati prosedur pemberian pinjaman / pembiayaan kepada nasabah. Ada beberapa
tahapan dalam proses perancangan aplikasi adapun Bahasa Pemograman yang digunakan dalam pembuatan
Sistem yang dimaksud adalah Menggunakan PHP dan MySQL. Aplikasi Pembuatan databasenya menggunakan
MySQL dan Xampp, Localhost Phpmyadmin. Semoga dengan adanya sistem informasi ini,dapat meningkatkan
Kinerja dalam proses pemberian pinjaman / pembiayaan kepada nasabah.
Kata kunci : Sistem, Sistem Informasi Database, MySQl, Xampp","",""
"212","Pengembangan Aplikasi Manajemen Informasi Sedekah Berbagi Makanan Berbasis Android Dengan Metode Rekayasa Perangkat Lunak Berorientasi Penggunaan Ulang","Rekayasa Perangkat Lunak","Memberi sedekah adalah salah satu aktivitas yang sangat dianjurkan dalam agama Islam. Memberi sedekah dapat berupa uang, barang atau makanan. Salah satu kendala pemberian sedekah adalah tidak adanya informasi terkait waktu dan tempat kegiatan sedekah. Oleh karena itu, dibutuhkan sebuah aplikasi manajemen informasi sedekah yang diharapkan dapat mengatasi permasalahan tersebut. Sistem ini membutuhkan sebuah aplikasi penampil peta untuk menunjukan lokasi kegiatan, pencarian lokasi terdekat dan komponen-komponen penggunaan ulang lainnya. Sehingga aplikasi ini menggunakan metode rekayasa perangkat lunak berbasis penggunaan ulang komponen dengan component retrieval dalam pengembangannya. Metode penggunaan ulang komponen diantaranya adalah analisis kebutuhan, analisis komponen, modifikasi kebutuhan, perancangan dengan penggunaan ulang, kontruksi serta pengujian. Aplikasi ini menggunakan bahasa pemodelan UML (Unified Modeling Languange), implementasinya menggunakan bahasa pemrograman Java dengan Android SDK (Software Development Kit). Pengujian dilakukan dengan pengujian unit, pengujian integrasi dan pengujian validasi. Pengujian unit dan integrasi menggunakan pendekatan kotak putih (white-box) serta pengujian validasi menggunakan pendekatan kotak hitam (black-box).
Kata kunci: aplikasi manajemen informasi sedekah, component retrieval, library, UML, android..","",""
"213","Analisis Pemilihan Penerapan Proyek Metodologi Pengembangan Rekayasa Perangkat Lunak","Rekayasa Perangkat Lunak","Metodologi merupakan kerangka pijakan utama dalam perancangan dan pengembangan perangkat lunak profesional untuk menghasilkan sebuah sistem informasi yang sesuai dengan kebutuhan bisnis sebuah organisasi. Keberhasilan pengembangan perangkat lunak bergantung pada pengelolaan proyek perangkat lunak secara keseluruhan. Tidak ada metodologi yang benar-benar sesuai dengan semua jenis organsasi, sehingga dibutuhkan pendekatan lebih lanjut untuk memilih metodologi mana yang paling sesuai untuk dapat diterapkan pada organisasi tertentu. Paper ini menjelaskan dan menganalisa metodologi pengembangan perangkat lunak yang meliputi: Linear Sequential Model atau Waterfall, Parallel Model, Iterative Model, Prototyping Model, RAD (Rapid Application Development) Model, Spiral Model, V-Shaped Model dan Agile Development untuk membuat perbandingan yang menunjukan kelebihan dan kelemahan masing-masing. Hasil paper ini menunjukan pertimbangan pemilihan metodologi yang didasarkan pada faktor-faktor kriteria penilaian yang terdiri dari kejelasan persyaratan pengguna, keakraban dengan teknologi, kompleksitas sistem, sistem keandalan, jadwal waktu singkat dan visibility jadwal hingga mereferensi beberapa pendapat dari jurnal ilmiah.
Kata Kunci : metodologi pengembangan rekayasa perangkat lunak, Linear Sequential Model, Waterfall, Parallel Model, Iterative Model, Prototyping Model, RAD (Rapid Application Development) Model, Spiral Model, V-Shaped Model, Agile Development","",""
"214","DIGITAL LIBRARY JURNAL DAN ARTIKEL DENGAN MODUL AUTOMATIC CITATION FORMAT BERBASIS WEB","Rekayasa Perangkat Lunak","Universitas Klabat mempunyai visi untuk menjadi Universitas Riset. Untuk mewujudkannya maka setiap tahun dosen-dosen diwajibkan untuk membuat penelitian, begitupun dengan mahasiswa di Universitas Klabat. Sebuah research University yang baik ditunjang dengan fasilitas sarana perpustakaan yang baik juga. Dosen dan mahasiswa sebagai peneliti dapat memanfaatkan sarana perpustakaan dengan optimal. Masalah yang ada dalam perpustakaan di Universitas Klabat adalah akses terhadap hasil penelitian, artikel dan jurnal untuk mendapatkan informasi. Selain itu, untuk publikasi penelitian saat ini masih dalam bentuk hardcopy sehingga untuk mengakses penelitian yang ada, mahasiswa harus pergi ke kantor fakultas. Oleh karena hal tersebut, penulis merancang Digital Library Jurnal dan Artikel dengan Modul Automatic Citation Format berbasis Web yang dapat membantu penyimpanan hasil penelitian dengan dilengkapi fungsi automation citation. Software ini berbasis web agar mudah diakses oleh berbagai platform mobile. Penelitian ini menggunakan metode rekayasa perangkat lunak dengan proses model prototyping. Hasil penelitian dapat membantu researchers untuk mengakses serta mengutip jurnal atau artikel dalam membuat penelitian khususnya mahasiswa dan dosen di Universitas Klabat.
Keywords : Jurnal, Artikel, Digital Library, Automatic Citation, Web, Proses Model Prototyping","",""
"215","PERANCANGAN PERANGKAT LUNAK SISTEM INFORMASI REKAM MEDIS BERBASIS CLIENT-SERVER STUDI KASUS KLINIK CIPANAS","Rekayasa Perangkat Lunak","Perancangan aplikasi rekayasa perangkat lunak sistem informasi rekam medis berbasis client-server di klinik cipanas adalah pengaplikasian dari sistem terkomputerisasi dalam bidang teknologi informasi. Perusahaan, klinik, pemerintah saat ini sangat mengutamakan teknologi terutama dibidang komputer, komputer sangat memegang peran penting dalam mendukung aktifitasnya. di klinik cipanas juga, teknologi informasi sangat penting bagi klinik. Dilihat dari latar belakang rekayasa perangkat lunak sistem informasi rekam medis masih terdapat kendala seperti pada saat proses pencarian data rekam medis pasien. Metodologi yang di pakai dalam perancangan ini adalah dengan Object Oriented Desain (OOD) dari Unified Approach (UA) Ali Bahrami (1999). Perancangan sistem masa depan merupakan tahapan setelah melakukan proses analisis. Dalam perancangan terdapat beberapa tahapan yang dilakukan yaitu perancangan kelas, metode, atribut, dan asosiasi, menyaring UML Class Diagram, perancangan layer akses dan layer antarmuka, dan terakhir yaitu proses pengujian. Ali Bahrami (1999).
Kata Kunci - Rekayasa Perangkat Lunak, Sistem Informasi, Client-server, Object Oriented Desain (OOD), UML.","",""
"216","Rekayasa Perangkat Lunak Berbasis Android sebagai Media Informasi Akademik Siswa SMK PKP 2 Jakarta","Rekayasa Perangkat Lunak","Perangkat mobile berbasis Android adalah perangkat smartphone yang sangat banyak penggunanya, hal ini dikarenakan untuk memperoleh perangkat tersebut tidaklah mahal dan selain itu banyak sekali fitur-fitur yang ditawarkan serta dalam penggunaannya tidak sulit. Seiring dengan maraknya penggunaan smartphone berbasis Android ini, bermacam-macam sistem informasi dalam kemasan mobile terus bergerak pesat. Dengan melihat perkembangan yang ada maka dalam penelitian ini akan dibangun sistem informasi berbasis Android sebagai media informasi akademik pada SMK PKP 2 Jakarta. Adapun dalam penelitian ini menggunakan pendekatan metode Agile Extreme Programming Model sebagai metode dalam pengembangan sistem dimana melalui metode ini peneliti dapat dengan sigap dan terarah untuk memenuhi kebutuhan pengguna sistem. Aplikasi yang dibangun sebelum diserahkan kepada pengguna diuji terlebih dahulu dengan metode black box untuk mengetahui setiap fungsi-fungsi dan aktivitas dalam sistem sehingga aplikasi yang dibangun dapat memberikan informasi yang tepat dan berguna bagi siswa SMK PKP 2 Jakarta. Aplikasi dibangun dengan nama aplikasi MAnAIS (Mobile Android Academic Information System) yang dapat berjalan pada perangkat mobile dengan sistem operasi Android. Hasil diperoleh dari pengujian menggunakan blackbox adalah 90% sistem berjalan dengan baik dan berdasarkan hasil kuisioner menerangkan bahwa 90% aplikasi baik digunakan bagi siswa SMK PKP 2 Jakarta.
Kata kunci: SMK PKP 2 jakarta, Android, sistem informasi akademik, agile extreme programming model, blackbox.","",""
"217","RANCANGAN SISTEM PERANGKAT LUNAK UNTUK INTERNAL ASSESSMENT PENGUKURAN KINERJA MBCFPE BERBASIS KPKU - BUMN","Rekayasa Perangkat Lunak","Malcolm Baldrige Criteria for Performance Excellence (MBCfPE) merupakan salah satu alat yang dapat
digunakan untuk melakukan pengukuran kinerja organisasi. Proses assessment resmi atau certified
penerapan MBCfPE membutuhkan biaya yang mahal. Perusahaan yang akan diases secara resmi dapat
melakukan persiapan berupa internal assessment. Begitu pula bagi perusahaan-perusahaan, terutama
perusahaan kecil – menengah, yang tidak menyediakan anggaran khusus untuk certified assessment dapat
tetap mengetahui performansi perusahaannya untuk mencapai kinerja yang ekselen melalui internal
assessment. Internal assessment merupakan proses pengukuran kinerja perusahaan yang dilakukan oleh
perusahaan oleh expert internal yang memahami konsep MBCfPE. Namun, bagi perusahaan yang baru
menerapkan MBCfPE dan belum memiliki certified examiner, maka internal assessment merupakan suatu
masalah terutama dalam menentukan score atau nilai dan menemukenali apa strengths dan opportunities
for improvement perusahaan sebagai bahan evaluasi perbaikan kinerja. Untuk membantu perusahaan
maka penelitian ini menghasilkan sistem perangkat lunak yang dapat membantu perusahaan dalam
melakukan internal assessment. Proses scoring di dalam sistem perangkat lunak ini dirancang berbasis
Kriteria Pengukuran Kinerja Unggul (KPKU) yang dikembangkan dan diterapkan oleh Kementerian
Badan Usaha Milik Negara (BUMN) untuk seluruh BUMN. KPKU dikembangkan oleh Kementerian
BUMN dari MBCfPE untuk mempermudah melakukan evaluasi, terutama bagi BUMN yang masih dalam
tahap awal penerapan MBCfPE
Kata kunci: Pengukuran kinerja, internal assessment, MBCfPE, KPKU-BUMN, perangkat lunak.","",""
"218","REKAYASA PERANGKAT LUNAK PENGOLAHAN DATA PRODUK MASUK DAN KELUAR MENGGUNAKAN PHP DAN MySQL (Studi Kasus  Suzuya Rocky Plaza Padang)","Rekayasa Perangkat Lunak","Suzuya Rocky Padang merupakan sebuah perusahaan yang memiliki produk fashion dan swalayan. Salah satunya yaitu produk fashion adalah busana yang menentukan penampilan seseorang dalam suatu acara tertentu. Suzuya Rocky Padang bekerjasama dengan pemilik produk suplair dalam berbisnis untuk saling memperoleh keuntungan. Suplair adalah orang yang memiliki pruduk yang bekerjasama dengan Suzuya untuk menjual produk kemudian dijaga dan dipromosikan oleh SPG (Sales Promotion Girl) agar barang tersebut laku dan terjual. Proses penyimpanan data barang yang masuk dan terjual tidak terkomputerisasi dan tidak terkait dengan sistem yang ada sekarang secara terperinci, sehingga memperlambat SPG dalam pembuatan laporan penjualan harian. Untuk membantu SPG dalam pembuatan laporan penjualan harian maka dirancang suatu aplikasi Rekayasa Perangkat Lunak Pengolahan Data Produk Masuk Dan Keluar Dengan Menggunakan bahasa pemrograman PHP (hypertext processor) dan MySql sebagai DBMS. Dengan adanya Aplikasi ini, SPG dapat membuat laporan penjualan harian di dalam sistem ini yang dikirim kepada masing-masing suplier yang telah ditentukan. Untuk memenuhi kebutuhan informasi penjualan selama proses produk masuk dan keluar sehingga dengan mudah memperoleh informasi.
Kata Kunci: Rekayasa Perangkat Lunak, Pengolahan Data, Produk Masuk Keluar, PHP, dan MySql","",""
"219","REKAYASA PERANGKAT LUNAK KRIPTOGRAFI MENGGUNAKAN ALGORITMA ADVANCED ENCRYPTION STANDARD (AES) 128 BIT PADA SISTEM KEAMANAN SHORT MESSAGE SERVICE (SMS) BERBASIS ANDROID","Rekayasa Perangkat Lunak","Layanan pesan singkat (SMS) merupakan salah satu media komunikasi pertukaran pesan yang populer digunakan, meskipun banyak aplikasi pertukaran pesan berbasis internet yang cenderung lebih hemat dan mudah, akan tetapi masih terhalang oleh jaringan tidak stabil. Android adalah sistem operasi dengan perkembangan yang paling maju saat ini, jumlah perangkat yang menawarkan sistem operasi ini meningkat tajam karena bertambahnya jumlah pengguna, kemudahan teknologi komunikasi disertai dengan keamanan yang meningkat, terutama keamanan dalam pertukaran informasi, salah satu cara untuk saling tukar informasi yang paling mudah dan yang paling populer adalah melalui layanan pesan singkat (SMS). Secara umum, sms di telepon genggam, android khususnya, rentan terhadap risiko pencurian informasi, karena sering pesan yang dikirimkan adalah pesan yang bersifat pribadi dan rahasia. Maka, dapat disimpulkan bahwa diperlukan sistem kriptografi yang diterapkan di android, guna mengamankan sms yang dikirim kepada penerima, tanpa rasa takut informasi akan bocor. Algoritma Edvanced Encryption Standard (AES) berjalan selama pengiriman pesan di android dapat menjadi satu jalan keluar untuk menyelesaikan masalah di atas , aplikasi ini memiliki tampilan yang sederhana dan menarik , karena itu aplikasi yang mudah digunakan dan tempat yang kokoh dalam solusi pertukaran informasi melalui sms.
Kata Kunci: SMS, Enkripsi, Dekripsi, Android, AES","",""
"220","REKAYASA PERANGKAT LUNAK ORDERING BIBIT RAMBUTAN OKULASI BERBASIS ANDROID MENGGUNAKAN ECLIPSE","Rekayasa Perangkat Lunak","Pertanian adalah salah satu komoditas yang sangat penting, tidak saja sebagai sumber
mata pencaharian tapi juga menduduki tatanan perekonomian nasional, usaha pertanian
memberikan sumbangan cukup besar sebagai sumber devisa dalam menopang pembangunan
nasional yang tinggi sehingga dapat dijadikan sebagai sumber pendapatan para petani ataupun
pihak lain yang berhubungan dengan petani, salah satunya dalam ordering bibit rambutan
okulasi.
Dengan memanfaatkan sistem operasi android yakni sebuah perangkat lunak untuk perangkat
mobile berbasis linux yang mencakup sistem operasi dan middleware serta menggunakan SQL Lite dalam
database, ordering bibit rambutan okulasi dibidang pertanian akan dapat menghasilkan informasi yang
lebih cepat, dan akurat serta memudahkan pihak-pihak yang bersangkutan dalam mengambil
suatu keputusan berdasarkan laporan yang ada.
.
Kata kunci : Aplikasi, okulasi, android, SQLLite","",""
"221","PERANCANGAN APLIKASI PERANGKAT LUNAK PENGELOLAAN DATA BANK SAMPAH DI PT. INPOWER KARYA MANDIRI GARUT","Rekayasa Perangkat Lunak","Pada dasarnya pengelolaan data sangatlah penting seperti halnya di Bank Sampah PT.
Inpower Karya Mandiri Garut, Bank Sampa h PT Inpower Karya Mandiri Garut setiap harinya
mengelola data sampah dan pengelolaannyapun masih menggunakan cara manual, dimana ditulis
dibuku besar atau buku agenda jadi resiko kehilangan data besar, selain itu petugas juga kesulitan
dalam mengelola da ta transaksi tabungan maupun inventory barang. Metodologi yang gunakan
dalam perancangan sistem/aplikasi ini yaitu metode USDP dari Nugroho (2010). Notasi pemodelan
menggunakan UML (Unified Modeling Language), sedangkan bahasa pemrograman yang
digunakan me ngunakan bahasa pemrograman PHP. Pencapaian hasil aplikasi pengelolaan data
bank sampah ini dapat mempercepat dan mempermudah pekerjaan Petugas dalam mengakomodasi
pengelolaan data Bank Sampah di PT. Inpower Karya Mandiri Garut secara efektip dan efesien.
Kata Kunci :
Aplikasi Pengelolaan Bank Sampah, USDP (Unified Software Development Process),
UML (Unified Modeling Language).","",""
"222","Rekayasa Perangkat Lunak Aplikasi Keputusan Multi Kriteria dengan Algoritma Analytic Network Process (ANP) Berbasis Android","Rekayasa Perangkat Lunak","Pengambilan keputusan multi kriteria merupakan salah satu teknik dalam menentukan sebuah pilihan
dari beberapa alternatif pilihan. Ada beberapa metode dalam mengambil keputusan, salah satunya yaitu
ANP (Analytic Network Process). ANP merupakan pengembangan dari metode AHP (Analytic
Hierarchy Process). AHP merupakan sebuah metode yang berbentuk hirarki dimana setiap kriteria
yang ada akan dibandingkan terlebih dahulu yang akan menghasilkan sebuah matriks biasa. Sedangkan
ANP merupakan sebuah metode jaringan yang membandingkan semua hal termasuk kriteria dan
alternatif yang ada sehingga mendapatkan suatu super matriks yang sangat kompleks. Saat ini metode
ANP tidak hanya dihitung tetapi sudah ada aplikasi penunjang salah satunya yaitu Super Decisions.
Aplikasi tersebut bisa digunakan untuk menghasilkan suatu keputusan dengan metode ANP. Setiap
aplikasi pasti memiliki kelebihan maupun kekurangan. Untuk itulah diperlukan adanya pengembangan
aplikasi yang sudah ada sebelumnya agar muncul aplikasi baru yang lebih baik.
Kata kunci: Penunjang Keputusan, Pengambilan Keputusan Multi Kriteria, Analytic Network Process,
Software Super Decisions, Aljabar Linier, Android.","",""
"223","Perangkat Lunak Diagnosa Penyakit Pada Manusia Berbasis Sistem Pakar","Rekayasa Perangkat Lunak","Kesehatan merupakan hal yang penting bagi manusia. Sistem pelayanan yang dimaksud
disini akan membahas tentang sistem pelayanan kesehatan. Sistem pelayanan kesehatan seperti ini
sebenarnya dapat diganti dengan sistem baru yang berbasiskan perangkat lunak asalkan diketahui
pola kerja seorang dokter dalam mendiagnosa suatu penyakit. Sehingga sistem ini akan sangat mudah
dijangkau oleh setiap orang dalam pengaksesannya dengan menggunakan metode sistem pakar.
Sistem pakar ini dibuat dengan menggunakan bahasa pemrograman Amzi Prolog dengan cara
mengadopsi dasar teori yang digunakan seperti, tahap analisa, perancangan (desain), pengodean,
pengujian, dan maintenance (pemeliharaan). Hasil pengujian sistem ini yang mengacu pada hasil user
acceptance test dan functionality test dapat ditarik kesimpulan bahwa perangkat lunak (software)
pada penggunaan sistem ini dapat dijalankan dengan baik dan berdasar tanggapan pengguna sistem
ini dapat dijalankan dengan baik, selain sistem ini diperlukan oleh pengguna juga hasil yang
diberikan oleh sistem ini sudah cukup akurat.
Kata kunci — Bahasa Prolog (Program Logic), berbasis sistem pakar.","",""
"224","REKAYASA PERANGKAT LUNAK UNTUK PENGEVALUASIAN KUALITAS JARINGAN FIBER OPTIK BERBASIS WEB PADA PGAS COM","Rekayasa Perangkat Lunak","PGAS COM adalah anak perusahaan dari Perusahaan Gas Negara (Persero) Tbk yang bergerak dalam bidang penyedia jaringan telekomunikasi dan layanan ICT Sulotion. Pengolahan data evaluasi kualitas jaringan fiber optik dilakukan dengan menggunakan pengukuran dengan parameter kualitas yang telah ditentukan. Proses pengolahan data ini menggunakan pencatatan manual sehingga penyusunan laporan evaluasi belum bisa dilakukan dengan cepat, hal ini menyebabkan terhambatnya layanan perbaikan yang diberikan. Tujuan penelitian ini adalah melakukan rekayasa perangkat lunak yang menghasilkan sistem informasi yang memudahkan dalam evaluasi kualitas jaringan fiber optik dan pembuatan laporan dengan mudah dan cepat. Penelitian ini menggunakan model pengembangan perangkat lunak extreme programming yang memiliki keunggulan yang lebih cepat dan proses pengembangan lebih responsive terhadap kebutuhan pelanggan. Alat pengembangan perangkat lunak menggunakan Unified Modeling Language (UML) dengan use case diagram, diagram activity, dan class diagram. Perangkat lunak yang digunakan dalam perekayasaan yaitu menggunakan Macromedia Dreamweaver, dan basis data menggunakan MySQL.Hasil peneltian ini adalah terwujudnya perangkat lunak dalam bentuk sistem informasi berbasis web untuk evaluasi kualitas jaringan fiber optik pada PGASCOM. Dengan adanya perangkat lunak ini diharapkan dapat mengolah data evaluasi kualitas jaringan fiber optik sehingga mempermudah petugas dalam penyusunan evaluasi dan pelaporan agar layanan yang diberikan lebih cepat.
Kata Kunci: rekayasa perangkat lunak, evaluasi jaringan fiber optik, unified modeling language","",""
"225","REKAYASA PERANGKAT LUNAK PENGENDALIAN INVENTORI MENGGUNAKAN METODE SMA (SINGLE MOVING AVERAGE) BERBASIS AJAX (ASYNCHRONOUS JAVASCRIPT AND XML) (STUDI KASUS PTP NUSANTARA VI (Persero) UNIT USAHA KAYU ARO )","Rekayasa Perangkat Lunak","Seiring tumbuh dan berkembangnya perusahaan dan meningkatnya aktivitas persaingan jual beli barang, maka menuntut kemampuan dan kecakapan para pengelola dalam pengambilan keputusan mengenai nilai jual yang akan dijalankan perusahaan, sehingga diharapkan mampu membantu mengatasi masalah yang dihadapi oleh perusahaan. Permasalah yang dihadapi perusahaan ini adalah perusahaan yang sering mengalami kesulitan dalam menentukan jumlah barang yang harus tersedia untuk bulan berikutnya agar tetap dapat memenuhi kebutuhan konsumen.
Tujuan penelitian ini adalah merancang aplikasi pengendalian inventori menggunakan metode Single Moving Average yang berbasis AJAX pada PTP Nusantara VI Kayu Aro.
Dengan adanya aplikasi pengendalian persediaan barang menggunakan metode single moving average ini dapat meminimalisir kesalahan pengecekan dan keterlambatan informasi persediaan barang, membantu mengetahui jumlah barang yang akan di sediakan untuk bulan berikutnya dan stok minimal barang dapat terkontrol dengan baik.
Kata Kunci : Pengendalian Inventori, Single Moving Average, dan AJAX","",""
"226","REKAYASA PERANGKAT LUNAK PADA INFORMASI PEMETAAN LOKASI WISATA DI LAMPUNG","Rekayasa Perangkat Lunak","Lampung merupakan propinsi yang memiliki banyak lokasi tempat wisata yang menarik, namun masih
banyak wisatawan yang masih belum mengetahuinya, hal ini dikarenakan kurangnya informasi mengenai
pariwisata yang ada di Lampung. Pariwisata merupakan bagian yang tidak terpisahkan dari kehidupan
manusia terutama menyangkut kegiatan sosial dan ekonomi. Sektor pariwisata juga merupakan salah
satu sumber pendapatan terbesar di suatu wilayah, khususnya di Lampung. Program wisata yang
didorong oleh Pemerintah Lampung untuk meningkatkan pendapatan daerah perlu didukung dengan
sistem informasi pemetaan lokasi wisata. Pemanfaatan teknologi untuk menunjang sektor pariwisata
sangat dibutuhkan agar para wisatawan mudah untuk mengakses infomasi tempat wisata, khususnya di
Lampung. Teknologi internet dan perangkat mobile dapat mendukung pengembangan Sistem Informasi
Geografis (SIG) untuk meningkatkan sektor pariwisata. Tujuan penelitian ini untuk mengembangkan
perangkat lunak sistem informasi pemetaan lokasi wisata di Lampung berbasis Android. Metode
penelitian yang digunakan adalah metode deskriptif dengan siklus pengembangan sistem xtreme
programming dan tool Unified Modeling Language antara lain use case diagram, activity diagram dan
class diagram. Penelitian ini menghasilkan rancangan dan perangkat lunak pada informasi pemetaan
lokasi wisata di Lampung berbasis Android. Rancangan yang dibuat digunakan untuk membantu
mengembangkan sistem informasi pemetaan wisata berbasis android sehingga wisatawan dapat mudah
dan cepat mencari dan memperoleh informasi tentang lokasi objek wisata yang terdapat di Lampung
Kata Kunci : android, rekayasa perangkat lunak, wisata","",""
