"No","Judul","Topik","Abstrak","",""
"70","Implementasi Data Mining Menggunakan Model SVM untuk Prediksi Kepuasan Pengunjung Taman Tabebuya","Data Mining","Taman merupakan objek wisata gratis. Taman merupakan objek wisata yang memuat unsure material keras dan lunak yang saling terkait satu sama lainnya yang sengaja dibuat oleh manusia dalam kegunaannya sebagai tempat penyegar dalam dan luar ruangan hingga banyak memberi manfaat bagi banyak orang. Wisata Objek Tabebuya di Jagakarsa DKI Jakarta Selatan adalah Taman wisata yang di peruntukan bagai masyarakat jakarta yang biasanya ramai pada hari biasa maupun hari liburan. Tempat ini sangat bagus dan bisa memberikan sensasi kenyamanan kondisi yang berbeda dengan aktivitas kita sehari-hari. Untuk dapat meningkatkan kunjungan wisatawan, Biasanya di sebut kepuasan pengunjung hal ini dapat terwujud peningkatan kualitas pelayanan. Penelitian ini bertujuan untuk memprediksi kepuasan pengunjung taman Tabebuya dengan metode algoritma SVM (Support Vector Machine) dimana eksperimen pada model divalidasi dan dievaluasi dengan Confusion Matrix dan AUC (Area Under Curve) dengan ROC (Receiver Operating Characteristic). Hasil daripenelitianmelakukanevaluasi dan validasi dapat disimpulkan bahwa algortima SVM memiliki akurasi dan performa secara rata-rata yaitu sebesar 86,00% dan nilai AUC sebesar 0.947.
Kata Kunci : Taman, Taman Tabebuya, Kepuasan Pengunjung, Algoritma SVM (Support Vector Machine)","",""
"71","IMPLEMENTASI DATA MINING PENJUALAN KORAN DENGAN METODE C4.5 (STUDI KASUS  PT. MEDIA MASSA CAHAYA PEMBAHARUAN)","Data Mining","Data mining adalah suatu istilah yang digunakan untuk menguraikan penemuan pengetahuan didalam database atau sering
disebut Knowledge Discovery in Database (KDD). Dengan berkembangnya informasi pada masa ini, kebutuhan akan
informasi yang akurat sangat dibutuhkan dalam kehidupan sehari-hari, sehingga informasi akan menjadi suatu elemen penting
dalam perkembangan masyarakat saat ini dan waktu mendatang. Namun kebutuhan informasi yang tinggi kadang tidak
diimbangi dengan penyajian informasi yang memadai, sering kali informasi tersebut masih harus di gali ulang dari data yang
jumlahnya sangat besar. Kemampuan teknologi informasi untuk mengumpulkan dan menyimpan berbagai tipe data jauh
meninggalkan kemampuan untuk menganalisis, meringkas dan mengekstrak pengetahuan dari data. Para pengambil keputusan
berusaha untuk memanfaatkan gudang data yang sudah dimiliki untuk menggali informasi yang berguna membantu mengambil
keputusan, hal ini mendorong munculnya cabang ilmu baru untuk mengatasi masalah penggalian informasi atau pola yang
penting atau menarik dari data dalam jumlah besar, yang disebut dengan data mining. Penggunaan teknik data mining
diharapkan dapat memberikan pengetahuan-pengetahuan yang sebelumnya tersembunyi di dalam gudang data sehingga
menjadi informasi yang berharga dan bermanfaat. Association rules termasuk jenis aturan assosi pada data mining. Salah
satunya tahap analisis assosiasi yang menarik perhatian banyak peneliti untuk m enghasilkan rulue pola frekwensi tinggi. Baik
tidaknya suatu assosiasi dapat diketahui dengan dua tolak ukur yakni support adalah nilai penunjang, persentase kombinasi
item didalam database dan confidence nilai kepastian, kuat hubungan item dalam aturan asosiasi..
Kata kunci : Penjualan Koran, Tanagra 1.4,Metode C4.5","",""
"72","IMPLEMENTASI DATA MINING UNTUK PENGATURAN LAYOUT MINIMARKET DENGAN MENERAPKAN ASSOCIATION RULE","Data Mining","Istilah data mining sudah berkembang jauh dalam mengadaptasi setiap bentuk analisa data, penelitian ini berupaya
mengembangkan strategi bisnis penyusunan layout produk yang disesuaikan dengan pola pembelian pelanggan di indomaret.
Salah satu teknik data mining yang digunakan untuk merancang strategi penyusunan layout produk yang efektif dengan
memanfaatkan data transaksi penjualan yang telah tersedia di perusahaan dengan menggunakan metode association rule.
Teknik ini dapat menemukan pola berupa produk-produk yang sering dibeli secara bersamaan. Penelitian ini bertujan untuk
menerapkan associstion rule kedalam penyusunan layout produk. Dari rule yang dihasilkan harapkan dapat membantu
perusahaan memudahkan dalam penyusunan layout produk.
Kata Kunci: Data Mining, Association Rule, Layout Produk","",""
"73","IMPLEMENTASI DATA MINING UNTUK REKOMENDASI BEASISWA PADA SD WR SUPRATMAN 2 MENGGUNAKAN ALGORITMA NEAREST NEIGHBOR","Data Mining","Banyaknya pemohon beasiswa, menjadi tantangan tersendiri bagi pihak pengelola lembaga pendidikan untuk dapat
memberikan suatu keputusan yang tepat, efektif dan efisien dalam pengelolaan data penerima besiswa yang benar-benar berhak
menerima beasiswa. Metode Nearest Neighbor menggunakan pendekatan untuk mencari kasus yang baru dengan yang lama.
Kedekatan kasus yang baru dengan yang lama ini dapat membuat penelitian akan mengetahui dan menerapkan pengetahuan
untuk merekomendasi Beasiswa dengan lebih efektif, dan nilai keakuratannya 90,90%. Kedekatan dengan nilai v tertinggi akan
menempati urutan teratas dalam metode ini dan mendapat hasil yaitu berhak menerima atau ditolak. Hasil dari penelitian ini
agar mampu mengetahui siswa SD WR SUPRATMAN 2 yang berhak mendapatkan beasiswa atau tidak berdasarkan data siswa
yang lama dibandingkan dengan data siswa yang baru dan dibantu oleh aplikasi Vb.net 2008.
Kata Kunci : Rekomendasi, Beasiswa, Algoritma Nearest Neighbor","",""
"74","Implementasi Data Warehouse Dan Data Mining Untuk Pengembangan Sistem Rekomendasi Pemilihan SMA","Data Mining","salah satu akibat dari semakin banyaknya jumlah siswa di wilayah tersebut. Namun peningkatan jumlah ini ternyata tidak
diimbangi dengan pengelolaan data sekolah yang baik misalnya menggunakan teknologi informasi. Tidak adanya pusat data
yang terintegrasi secara baik menyebabkan pihak sekolah kesulitan menyampaikan informasi akademik dan masyarakat sulit
mendapatkan informasi yang valid sehingga banyak calon siswa yang ragu untuk menentukan sekolah menengah tingkat atas
yang akan dituju sesuai dengan kriterianya. Berdasarkan hal tersebut, sebuah data warehouse diperlukan sebagai pengelola data
sekolah-sekolah secara terintegrasi dengan baik dan dikembangkan sistem rekomendasi dengan menerapkan teknik data mining.
Dengan demikian, data sekolah dapat digali untuk menghasilkan suatu informasi yang dapat dimanfaatkan sebagai rekomendasi
bagi calon siswa sekolah menengah atas untuk menentukan pilihan sekolah yang dituju. Sebuah diagram snowflake dirancang
sebagai langkah awal dalam pengembangan data warehouse. Data yang dikirim ke data warehouse terlebih dahulu diproses
melalui tahap ekstraksi, transformasi dan load. Sementara itu, sistem rekomendasi dibangun dengan menerapkan metode
naïve bayes dengan cara menghitung probabilitas masing-masing kriteria yang diajukan berdasarkan data pelatihan dalam data
warehouse. Adapun kriteria yang digunakan yaitu biaya sekolah, jarak sekolah, nilai akreditasi, tingkat kelulusan, dan nilai rerata
ujian akhir nasional. Hasil penelitian menunjukkan bahwa sebuah data warehouse telah berhasil dibangun sebagai pengelola data
sekolah di Sragen yang terintegrasi dan terhubung dengan sistem rekomendasi untuk membantu calon siswa memilih sekolah
yang sesuai kriteria-kriteria yang diajukan. Rekomendasi yang dihasilkan oleh sistem berdasarkan nilai probabilitas tertinggi dari
setiap variabel masing-masing sekolah, tingkat prioritas variabel, serta urutan rangking sekolah.
Kata kunci: data mining, data warehouse, naive bayes, sistem rekomendasi sekolah","",""
"75","Implementasi Sistem Data Mining Untuk Menentukan Stock Accuracy Pada Warehouse PT Coca-Cola Amatil Indonesia Cibitung–Plant","Data Mining","Data Mining merupakan suatu proses penggalian data atau penyaringan data yang memanfaatkan kumpulan data
dengan ukuran yang besar melalui serangkaian proses untuk mendapatkan informasi yang berharga dari data tersebut. PT.
Coca-Cola Amatil Indonesia Cibitung-Plant memiliki salah satu gudang terbesar di Indonesia tepatnya Warehouse Mega
Distribution Center (DC), dengan luas gudang ±32000 m2 atau setara dengan ±30000 Pallet. Untuk menjaga keakuratan stok
di warehouse tentunya diperlukan suatu sistem yang baik agar dapat menunjang kegiatan operasional di dalam warehouse,
salah satu cara untuk menjaga keakuratan stok di dalam warehouse yaitu dengan melakukan penghitungan produk secara
keseluruhan di dalam warehouse (Stock Opname), agar dapat diketahui keakuratan data di dalam sistem dengan stok fisik
yang ada di gudang. Dengan adanya data transaksi yang tersimpan dalam basis data, terkadang data transaksi tersebut hanya
dibiarkan menumpuk tanpa ada tindakan yang lebih lanjut, maka dibuatkannya sistem informasi yang mengolah data tersebut
untuk menggali informasi dengan teknik data mining.
Kata Kunci: Data Mining, Stock Opname, Warehouse.","",""
"76","KLASTERISASI DATA JAMAAH UMROH PADA AULIYA TOUR & TRAVEL MENGGUNAKAN METODE K-MEANS CLUSTERING","Data Mining","Perjalanan wisata religi khususnya untuk ibadah haji dan umroh semakin diminati masyarakat. Auliya Tour & Travel yang bergerak pada bidang biro perjalanan memiliki data jamaah yang beragam sehingga kumpulan data tersebut dimanfaatkan untuk menemukan pengetahuan yang baru sebagai strategi pemasaran dengan menggunakan teknik Data Mining. Data Mining merupakan salah satu proses dari KDD yang fungsi salah satunya untuk pengelompokan. K-Means Clustering merupakan salah satu teknik Data Mining yang bertujuan untuk mengelompokkan data ke dalam subset data. Pengelompokan data jamaah umroh dilakukan bertujuan untuk mengetahui kelompok minat jamaah berdasarkan usia. Penelitian ini mengelompokkan data jamaah menjadi tiga cluster yaitu sangat diminati, diminati dan kurang diminati. Atribut yang digunakan dalam pengolahan data meliputi jenis kelamin, usia, dan paket jamaah. Sebelum proses perhitungan data dilakukan terlebih dahulu dilakukan proses transformasi data. Berdasarkan perhitungan data yang telah dilakukan melalui software RapidMiner diperoleh anggota kelompok sangat diminati dari rentang usia mulai 56 sampai 83 tahun, kelompok diminati dengan rentang usia mulai 29 sampai 55 tahun dan kelompok kurang diminati mulai usia 2 sampai 22 tahun dari 170 record.
Kata Kunci: Clustering, Data Mining, K-Means, RapidMiner, Umroh.","",""
"77","Komparasi Metode Data Mining K-Nearest Neighbor Dengan Naïve Bayes Untuk Klasifikasi Kualitas Air Bersih (Studi Kasus PDAM Tirta Kencana Kabupaten Jombang)","Data Mining","Air adalah merupakan senyawa kimia yang sangat dibutuhkan bagi kelangsungan hidup makhluk hidup yang ada di bumi. Wilayah terluas di planet bumi merupakan air yang menutupi hampir 71% wilayah yang ada di bumi. Air juga merupakan zat yang sangat penting yang ada di bumi yang sangat dibutuhkan oleh semua makhluk hidup mulai dari tumbuhan, hewan dan manusia. Dibutuhkan pengawasan dan pengolahan lingkungan sekitar sumber air sehingga dapat menghasilkan kualitas air yang bersih sesuai dengan standar kualitas air bersih dan memenuhi standar air yang layak dikonsumsi oleh manusia. Untuk menentukan klasifikasi kualitas air bersih terdapat banyak metode yang dapat digunakan. Untuk memilih metode klasifikasi yang paling cocok, dapat dilakukan komparasi antara beberapa metode. Penelitian ini melakukan komparasi antara metode K-Nearest Neighbor dan Naïve Bayes. Berdasarkan dari beberapa penelitian, metode K-Nearest Neighbor dan Naïve Bayes merupakan metode yang cukup baik dan menghasilkan tingkat akurasi yang cukup tinggi. Berdasarkan hasil pengujian, diperoleh rata-rata nilai akurasi metode K-Nearest Neighbor sebesar 82.42% dan rata-rata nilai akurasi metode Naïve Bayes sebesar 70.32%. Dapat disimpulkan bahwa metode yang paling baik untuk klasifikasi kualitas air bersih adalah metode K-Nearest Neighbor.
Kata kunci: kualitas air bersih, data mining, klasifikasi, komparasi metode, k-nearest neighbor, naïve bayes","",""
"78","KOMPARASI METODE DATA MINING UNTUK PENENTUAN PROSES PERSALINAN IBU MELAHIRKAN","Data Mining","Proses Persalinan merupakan hal yang dinanti oleh setiap ibu yang sedang melahirkan. Dalam proses
persalinan terdapat dua jenis proses persalinan yaitu secara normal atau sesar. Dalam proses per-salinan
terdapat resiko persalinan yang dihadapi yaitu komplikasi ibu melahirkan yang dapat mem-perburuk
kondisi ibu melahirkan. Resiko terburuk yang dapat saja terjadi adalah kematian ibu dan/ atau bayi yang
baru dilahirkan. Data mining merupakan metode yang populer digunakan untuk menggali pola atau
ilmu pengetahuan dari tumpukan data yang besar. Dalam penelitian ini dilakukan komparasi metode
data mining untuk pengolahan data ibu melahirkan dengan menggunakan algo-ritma C4.5, naive bayes
dan neural network. Dari penelitian diketahui nilai akurasi untuk pengolahan data ibu melahirkan untuk
penentuan proses persalinan dengan metode naive bayes yaitu 94%, neural network 936%, dan
algoritma C4.5 yaitu 90%.
Kata Kunci: data mining, persalinan, komparasi","",""
"79","MERANCANG STRATEGI PENJUALAN PRODUK JASA PELATIHAN DENGAN MENGGUNAKAN METODE DATA MINING","Data Mining","Sciencom adalah perusahaan yang bergerak di bidang jasa pelatihan dengan fokus di bidang teknologi informasi. Persaingan bisnis jasa pelatihan di Indonesia sangat ketat terbukti dari semakin banyaknya perusahaan sejenis di Indonesia khususnya Jakarta yang saat ini menjadi fokus perusahaan dalam mengembangkan bisnisnya. Hingga saat ini 90% pelanggan perusahaan adalah kementerian atau lembaga negara Indonesia. Perusahaan sangat jarang mendapatkan permintaan pelatihan dari perusahaan swasta atau perorangan. Tujuan dari penelitian ini adalah merancang strategi pemasaran yang sangat dibutuhkan untuk meningkatkan penjualan, menarik pelanggan baru dan loyalitas pelanggan terhadap Sciencom. Metode yang digunakan dengan memanfaatkan konsep business intelligence yaitu penggunaan metode data mining untuk mengolah data registrasi peserta setiap melakukan pelatihan untuk mengolah, menganalisa dan mengevaluasi data sehingga didapatkan keputusan strategi pemasaran yang bagus untuk diterapkan. Hasil dari penelitian ini dideskripsikan bahwa atribut berpengaruh terhadap prediksi peserta yang terdaftar sebagai peserta pelatihan sehingga dapat dibuat rancangan strategi pemasaran yang baik.
Kata kunci: Business Intelligence, Data Mining, Pemasaran","",""
"80","Metode Data Mining Terhadap Data Penjualan Sparepart Mesin Fotocopy Menggunakan Algoritma Apriori","Data Mining","Penjualan produk sparepart mesin fotocopy semakin diperlukan. Untuk mengetahui produk sparepart mesin fotocopy dengan penjualan terbanyak yang terjual secara bersamaan dibutuhkan metode agar didapatkan informasi baru. Yaitu dengan menggunakan algoritma Apriori dan bantuan tools Tanagra. Algoritma Apriori adalah jenis aturan asosiasi pada data mining. Dengan menggunakan perhitungan algoritma Apriori maka dapat ditentukan produk sparepart mesin fotocopy yang banyak terjual secara bersamaan yang bermanfaat dalam penyelesaian strategi pemasaran agar lebih meningkatkan tingkat penjualan. Dari hasil penelitian ini dapat ditemukan produk yang paling banyak terjual yaitu drum dc dan toner, dengan menghasilkan kesimpulan bahwa produk Toner dan Drum dc dengan nilai support 50% dan nilai confidence 66,67% atau produk Drum Dc dan Toner dengan nilai support 50% dan nilai confidence 85,71%.
Kata kunci: Algoritma apriori, Data mining, Penjualan","",""
"81","METODE DATA MINING UNTUK SELEKSI CALON MAHASISWA PADA PENERIMAAN MAHASISWA BARU DI UNIVERSITAS PAMULANG","Data Mining","Universitas Pamulang berusaha memberikan pendidikan tinggi dengan biaya yang terjangkau oleh kalangan bawah. Tetapi mahasiswanya banyak yang keluar di tiap semester, sehingga menyebabkan rasio jumlah mahasiswa baru dengan jumlah yang lulus tidak seimbang. Selain itu banyak mahasiswa yang tidak lulus tepat waktu, hal ini mengakibatkan rasio dosen dan mahasiswa tidak seimbang. Kedua hal ini akan mengurangi penilaian pada saat akreditasi. Penyebab keluarnya mahasiswa tanpa menyelesaikan pendidikannya, atau tidak dapat menyelesaikan pendidikannya tepat waktu belum dapat dideteksi dengan sistem seleksi saat ini. Pada penelitian ini diusulkan penggunaan teknik data mining untuk memprediksi ketepatan waktu lulus calon mahasiswa. Teknik data mining dan machine learning dapat digunakan untuk memprediksi berdasarkan data-data masa lalu. Metode data mining yang digunakan untuk memprediksi adalah klasifikasi, yaitu Naïve Bayes (NB), k-Nearest Neighbor (k-NN), Random Forest (RF), Decision Stump (DS), Decision Tree (DT), Rule Induction (RI), Linear Regression (LR), Linear Discriminant Analysis (LDA), Neural Network (NN), dan Support Vector Machine (SVM). Berdasarkan hasil implementasi dan pengukuran algoritma/model yang diusulkan diperoleh algoritma/model terbaik, yaitu Support Vector Machine (SVM) dengan akurasi 65.00%. Tetapi akurasi ini masih jauh dari nilai excellent (sangat baik).
Kata kunci: Data Mining, Klasifikasi, Penerimaan Mahasiswa","",""
"82","PEMANFAATAN DATA MINING DENGAN METODE CLUSTERING UNTUK EVALUASI BIAYA DOKUMEN EKSPOR DI PT WINSTAR BATAM","Data Mining","Data Mining merupakan teknologi yang sudah ada dan berkembang cukup lama. Banyak perusahaan yang kurang memanfaatkan data-data lama yang tersimpan di dalam database, untuk dimanfaatkan semaksimal mungkin. Penelitian ini mencoba menerapkan teknologi Data Mining dengan menggunakan metode clustering untuk mendapatkan pengetahuan baru, yang diharapkan bermanfaat bagi kelangsungan dan perkembangan perusahaan. Algoritma yang digunakan yaitu K-Means Clustering yaitu proses pengelompokan sejumlah data atau objek ke dalam cluster (group) sehingga setiap cluster tersebut akan berisi data yang semirip mungkin dan berbeda dengan objek dalam cluster yang lainnya. Pengujian dilakukan dengan aplikasi Rapid Miner 5.3. Hasilnya adalah cluster-cluster pengelompokan data pelanggan yang disarankan untuk di evaluasi biaya pengurusan dokumen ekspornya.
Kata Kunci : Data Mining, K-Means Clustreing, Evaluasi Biaya Dokumen Ekpor.","",""
"83","Pemanfaatan Data Mining Untuk Penempatan Buku Di Perpustakaan Menggunakan Metode Association Rule","Data Mining","Data Mining merupakan proses analisa data untuk menemukan suatu pola dari kumpulan data
yang tersembunyi dengan memanfaatkan data kunjungan perpustakaan, dapat menggali
informasi tentang buku- buku apa yang sering dipinjam oleh pengunjung dan keterkaitan antar
masing-masing peminjaman hingga dapat melakukan penyusunan dan tata letak buku. Pada
sistem yang berjalan penempatan buku dilakukan berdasarkan kategori buku yang telah
tersedia pada rak buku namun belum diatur berdasarkan intensitasi peminjaman buku yang
dilakukan oleh anggota sehingga masih banyak buku-buku lama yang masih tersedia di
perpustakaan. Untuk dapat melakukan penempatan buku sesuai dengan kebutuhan anggota
perlu dilakukan suatu proses pengolahan data peminjaman buku dengan menggunakan
algoritma appriori melalui penerapan metode association rule agar dapat diketahui support
dan confidance antara buku-buku yang sering di pinjam sehingga dapat diketahui pola
penempatan buku. Dibandingkan dengan sistem yang sedang berjalan kinerja tersebut
ditunjukan pada efektifitas informasi dari sistem tentang penentuan pola penempatan buku
untuk tata letak buku dan memudahkan dalam mengetahui keberadaan buku dalam hal ini
berdasarkan 3 item set buku.
Kata kunci: Data Mining, Rule Assosiasi, Perpustakaan.","",""
"84","Penerapan Algoritma Apriori dalam Data Mining untuk Memprediksi Pola Pengunjung pada Objek Wisata Kabupaten Karo","Data Mining","Klasifikasi association rule merupakan salah satu teknik dalam data mining yang digunakan
dalam penelitian ini untuk mengolah data pengunjung dalam objek wisata. Pada penelitian ini
untuk mendapatkan pola/rule pengunjung wisata aplikasi bantu yang digunakan adalah weka,
Associatiation rule adalah data mining yang berguna untuk menemukan suatu korelasi atau
pola yang terpenting/menarik dari sekumpulan data besar. Algoritma Apriori adalah salah satu
algoritma yang melakukan pencarian frequent itemset dengan menggunakan teknik
association rule, dengan menggunakan algoritma apriori dapat menghasilkan pola pengunjung
dari tanah 2015 dan 2016 pada objek wisata kabupaten karo, dengan algoritma Apriori dapat
disimpulkan bahwa pada tahun 2015 jumlah pengunjung lebih sedikit. Pada penelitian ini data
yang digunakan sebanyak 122 data jumlah pengunjung bulanan pada pariwisata dari tahun
2015 hingga 2016. Hasil pengujian menunjukkan bahwa nilai confiden yang paling tinggi
mencapai 0,92.
Keywords – pariwisata, apriori, data mining, frequent itemset","",""
"85","PENERAPAN DATA MINING DALAM MENENTUKAN PILIHAN JURUSAN BIDANG STUDI SMA MENGGUNAKAN METODE CLUSTERING DENGAN TEKNIK SINGLE LINKAGE","Data Mining","Salah satu cara untuk meningkatkan kualitas siswa sekolah menengah adalah dengan membentuk kelas favorit di mana kelas akan menjadi kelas unggulan dibandingkan dengan kelas lain. Siswa akan dipilih berdasarkan 3 variabel, yaitu indeks kehadiran, nilai rata-rata semester dan juga etika siswa itu sendiri. Data mining adalah penambangan atau penemuan informasi baru dengan mencari pola tertentu atau aturan sejumlah besar data yang diharapkan untuk mengatasi kondisi tersebut, memanfaatkan data yang diperoleh dari SMA untuk mengelompokkan siswa menggunakan metode pengelompokan menggunakan teknik hubungan tunggal. Dengan menggunakan metode clustering diharapkan akan mempermudah pengelompokan siswa - siswa yang masuk ke kelas XI. Jadi hasil penelitian ini juga akan digunakan dalam menentukan siswa - siswa yang akan masuk kelas jurusan. Kata kunci: Data Mining, clustering, single lingkage, pemilihan departemen
PENDAHULUAN
Lembaga pendidikan seperti pendidikan SMA","",""
"86","PENERAPAN DATA MINING MENGGUNAKAN ASSOCIATION RULES UNTUK MENDUKUNG STRATEGI PEMASARAN","Data Mining","Pertumbuhan yang pesat dari akumulasi data telah menciptakan kondisi kaya akan
data tapi minim informasi. Data mining m merupakan penambangan atau penemuan
informasi baru dengan mencari pola atau aturan tertentu dari sejumlah data dalam jumlah
besar yang diharapkan dapat mengatasi kondisi tersebut. Dengan memanfaatkan data calon
mahasiswa dan data mahasiswa, diharapkan dapat menghasilkan informasi tentang sumber
informasi yang digunakan oleh calon mahasiswa yang dapat dimanfaatkan oleh manajemen
dalam melakukan usaha-usaha yang terkait dengan peningkatan jumlah mahasiswa dengan
melakukan pemilihan media promosi yang tepat melalui teknik data mining.
Algoritma yang digunakan adalah algoritma apriori, informasi yang ditampilkan
berupa nilai support dan confidence dari masing-masing pola yang terbentuk. Dari uji
coba terhadap data calon mahasiswa dan data mahasiswa dengan model Association rules
dihasilkan beberapa aturan dengan tingkat nilai maksimum confidence sebesar 81,1%
Untuk sumber informasi yang berasal dari media Koran dan tingkat nilai maksimum
confidence sebesarb 77,8% untuk sumber informasi melalui media brosur.Saatini media
promosi yang tepat untuk digunakan oleh timp emasaran dalam menjaring calon
mahasiswa baru adalah media Koran dan media brosur dengan tidak mengabaikan media
promosi yang lain.
Kata kunci: data mining, Association rules, algoritma apriori, confidence, support","",""
"87","PENERAPAN DATA MINING MENGGUNAKAN ALGORITMA K-MEANS UNTUK MENGETAHUI MINAT CUSTOMER DI TOKO HIJAB","Data Mining","Hijab bukanlah hal yang asing bagi penduduk di Indonesia, karna sebagian besar dari penduduk Indonesia beragama islam. Saat ini banyak para pelaku bisnis terutama penjual hijab yang menyediakan berbagai macam brand dan model pada hijab yang mereka jual. Oleh sebab itu para penjual di tuntut untuk dapat berfikir cerdas dalam membuat strategi penjualan yang pastinya akan berguna untuk mengetahui dengan jelas produk mana yang paling diminati oleh para customer, dan juga untuk meningkatkan penjualan pada toko mereka. Maka perlu adanya suatu alternatif yang dapat mewujudkan pencatatan data transaksi penjualan dengan lebih cepat dan terstruktur. Dalam penelitian ini penulis menerapkan algoritma k-means untuk mengetahui minat customer terhadap produk yang mereka jual. Pada perhitungan yang telah dilakukan dengan menggunakan dua buah parameter yaitu transaksi dan jumlah penjualan dan melewati tiga kali melakukan iterasi dengan hasil iterasi satu mendapatkan nilai rasio sebesar 0,374324132, iterasi dua mendapatkan rasio 0,543018325, dan iterasi tiga mendapatkan nilai rasio yang sama dengan iterasi kedua. Maka dapat disimpulkan bahwa hijab yang paing diminati oleh para customer adalah hijab dengan brand Rabbani, Elzatta, dan Zoya, hijab yang peminatnya rendah dengan brand Dian Pelangi, Kami Idea, dan Meccanism. Dan hijab dengan peminat yang tidak tinggi dan juga tidak rendah adalah hijab dengan
brand Ria Miranda, Jenahara, Shasmira, dan
Shafira.
Kata Kunci: Hijab, Minat Customer, Metode KMeans","",""
