"No","Judul","Topik","Abstrak","",""
"1","SISTEM INFORMASI PENJADWALAN DOKTER BERBASIS WEB DENGAN MENGGUNAKAN FRAMEWORK CODEIGNITER (STUDI KASUS: RUMAH SAKIT YUKUM MEDICAL CENTRE)","Basis Data","Rumah Sakit Yukum Medical Centre merupakan perusahaan yang bergerak pada bidang kesehatan yang berdiri di Yukum Jaya Kabupaten Lampung Tengah. Sistem penjadwalan di Rumah Sakit Yukum Medical Centre masih menggunakan kertas apabila pasien ingin mengetahui informasi jadwal dokter dapat menanyakan kebagian informasi. Faktor kesehatan merupakan salah satu faktor yang penting dalam kehidupan masyarakat. Terutama untuk mendapatkan layanan kesehatan ketika sakit atau membutuhkan pelayanan kesehatan seperti hanya sekedar konsultasi. Sistem Informasi Penjadwalan Dokter Berbasis Web dapat menjadi solusi untuk pengolahan data serta dapat memberikan infomasi tentang kesehatan dan jadwal dokter kepada pasien yang lebih akurat. Selanjutnya pada tahapan pengembangan sistem dengan model waterfall (Air Terjun). Analisis perancangan meliputi Use Case Diagram, Activity Diagram, Class Diagram, dan Sequence Diagram. Implemeentasi menggunakan alat seperti Framework Codeigniter sebagai desain tampilan antarmuka dan MySQL sebagai pengolahan database. Pengujian sistem dilakukan dengan pengujian BlackBox ISO 9126 dan WhiteBox. Hasil pengujian yang telah dilakukan dapat disimpulkan bahwa dengan adanya sistem Informasi Penjadwalan Dokter Berbasis Web dengan menggunakan Framework Codeigniter dapat memberikan informasi jadwal praktik dokter dengan cepat dan akurat dan menjadikan proses penjadwalannya lebih efisien Kata Kunci : Penjadwalan, Dokter, Web, Framework, Codeigniter, Unified Modelling Language","",""
"2","E-Learning Sebagai Media Pembelajaran Berbasis Web Pada Smk N 4 Purworejo","Basis Data","Ujian Nasional terutama SMK sekarang sudah menerapkan sistem UNBK (Ujian Nasional Berbasis Komputer), SMK Negeri 4 Purworejo sampai saat ini belum menerapkan sistem e-learning dalam proses belajar mengajar, terutama untuk persiapan UNBK. Oleh karena itu, diperlukannya sistem e-learning yang dapat memudahkan siswa dalam belajar dan tentunya siswa dapat terbiasa dengan pelaksanaan ujian berbasis komputer. Dilihat dari permasalahan tersebut penulis membuat sebuah sistem e-learning berbasis web menggunakan metode waterfall, berdasarkan observasi, wawancara dan studi pustaka yang sudah dilakukan. Sistem e-learning ini dapat memudahkan siswa terbiasa dengan pelaksanaan ujian berbasis komputer dan dapat memperdalam ilmu pengetahuan terutama dalam menghadapi ujian nasional berbasis komputer. Tujuan dari pembuatan sistem e-learning ini untuk memudahkan pembelajaran di SMK Negeri 4 Purworejo terutama kelas XII dan mendukung ujian nasional berbasis komputer, karena terdapat fasilitas download materi, mengerjakan latihan soal dan dapat berkomunikasi langsung dengan guru melalui forum diskusi. Sistem e-learning ini dibuat dengan menggunakan bahasa pemrograman PHP yang didukung basis data MySQL. Sistem e-learning ini dapat memudahkan dan mendukung siswa dalam pelaksanaan UNBK pada SMK Negeri 4 Purworejo. Kata Kunci: E-Learning, Media Pembelajaran, Web, Ujian Nasional","",""
"3","PENERAPAN PENDEKATAN MACHINE LEARNING PADA PENGEMBANGAN BASIS DATA HERBAL SEBAGAI SUMBER INFORMASI KANDIDAT OBAT KANKER","Basis Data","Penyakit kanker merupakan masalah epidemiologis di tanah air. Pengembangan obat modern sejauh ini masih bergantung pada laboratorium farmakologi dan kimia bahan alam yang dapat memiliki efek samping. Namun, pengembangan obat untuk penyakit kanker sudah memasuki tahap biologi molekuler, dimana interaksi struktur kimia ligan dengan protein reseptor dapat dikaji dengan ketelitian tinggi. Berbagai tipe senyawa kimia, mulai dari sintetik, semi sintetik, hingga bahan alam, dikembangkan untuk keperluan melawan penyakit yang dianggap paling berbahaya tersebut. Dalam konteks pengembangan obat berbasis herbal, telah ditemukan senyawa bahan alam dalam jumlah banyak. Data tersebut dikurasi dan dianotasi oleh basis data milik China, Taiwan, Indonesia, Jepang, maupun beberapa negara lainnya. Hanya saja, permasalahan timbul ketika memilih senyawa bioaktif terbaik untuk dikembangkan untuk melawan penyakit kanker. Kompleksitas timbul karena jalur metabolik penyakit kanker sangat beragam, tergantung pada tipe dan fasenya. Oleh karena itu, dalam telaah sistematis ini, disajikan telaah pendekatan machine learning untuk melakukan penapisan terhadap pustaka senyawa bioaktif tersebut, kemudian proses seleksi kandidat yang terbaik untuk operasi simulasi molekuler, dan selanjutnya teruji validitasnya pada wet experiment. Sehingga proses automatisasi pengembangan kandidat obat bagi penyakit kanker dapat dicapai dengan sangat signifikan. Diketahui bahwa metode machine learning paling efektif dan efisien adalah Naïve Bayes. Namun yang terbaik dalam mengolah data senyawa dalam jumlah besar adalah SVM classifier. Kedepannya, metode deep learning sangat menjanjikan untuk komputasi data senyawa bioaktif yang kompleks. Kata kunci: machine learning, pengembangan obat, senyawa bahan alam, jalur metabolik, penyakit kanker","",""
"4","PERANCANGAN SISTEM INFORMASI PERSEDIAAN BAHAN BAKU","Basis Data","Ketersediaan pasokan bahan baku merupakan hal yang sangat penting dalam menjaga keberlangsungan proses produksi di suatu perusahaan. Tujuan penelitian ini adalah merancang sistem informasi persediaan bahan baku berbasis web untuk memenuhi kebutuhan pengguna dalam pengendalian persediaan bahan baku kacang shanghai. Metode pendekatan sistem yang digunakan dalam penelitian ini adalah prototyping. Perancangan sistem menggunakan konsep Object Oriented Programming (OOP) dengan UML versi 2.0, database MySQL dan XAMPP sebagai local server serta bahasa pemrograman PHP. Informasi yang dihasilkan adalah informasi mengenai daftar bahan baku, pasokan bahan baku, penggunaan bahan baku, serta ketersediaan bahan baku kacang shanghai dalam gudang. Uji verifikasi dan validasi menggunakan metode black box serta uji rancangan sistem menunjukkan bahwa hasil rancangan sistem informasi telah berjalan dengan baik dan sesuai yang diharapkan.
Kata kunci: bahan baku, kacang, persediaan, sistem informasi","",""
"5","Sistem Informasi Akademik Berbasis Web padaLKP Rejeki Cilacap","Basis Data","Sistem informasi akademik yang masih manual yaitu pengolahan nilai masih menggunakan tulis tangan serta pemberitahuan nilai dan pengumuman akademik lainnya peserta didik harus datang ke LKP. Untuk itu dibuatlah sistem informasi akademik yang berbasis websehingga peserta didik yang ingin mendapatkan informasi akademik tidak lagi datang ke LKP dan lebih praktis tanpa meluangkan waktu ke instansi pendidikan tersebut. Di dalam web ini Pengelolaan sistem informasi akademik terbagi kedalam 4 pengguna yaitu admin, guru, siswa, dan pengunjung. User diberikan hak akses tertentu, admin diberikan hak akses berupa pengelolaan secara keseluruhan mulai dari pengelolaan input data siswa, data nilai, data guru, informasi akademik yang akan diinformasikan pada berita akademik. Kemudian guru diberikan hak akses untuk memasukkan data nilai siswa, dan informasi umum seputar akademik seperti jadwal dan updoad materi, dan siswa hanya bisa mengakses data nilai pribadi, serta informasi berita akademik seperti jadwal dan materi. Website ini hanya menginformasikan tentang penilaian harian, nilai tugas, nilai UTS, UAS, hasil nilai, dan sertifikat. Dengan dibuatnya sistem secara online dapat tercapai suatu kegiatan yang efektif dalam menunjang aktifitas LKP yang lebih kondusif dibandingkan dengan sistem manual. Kata Kunci: Sistem Informasi, Akademik, Web, Pengolahan Nilai, Nilai","",""
"6","DESAIN APLIKASI SISTEM INFORMASI GEOGRAFIS PEDAGANG PASAR MENGGUNAKAN VISUAL BASIC DAN DOTSPATIAL (STUDI KASUS: PASAR BINTORO KABUPATEN DEMAK)","Basis Data","Keberadaan pasar mempunyai fungsi yang sangat penting. Bagi konsumen, adanya pasar akan mempermudah memperoleh barang dan jasa kebutuhan sehari-hari. Secara umum, pasar mempunyai tiga fungsi utama yaitu sebagai sarana distribusi, pembentukan harga, dan sebagai tempat promosi. Pasar bintoro sebagai pasar terbesar di Kabupaten Demak menjadi penunjang sektor perekonomian termasuk sektor UMKM, pertanian, dan pariwisata. Lokasi Pasar Bintoro relatif dekat dengan Masjid Agung Demak dan makam Sunan Kalijaga. Seiring berkembangnya teknologi, dapat dibuat sistem informasi berbasis Geographic Information System (GIS) desktop dengan bantuan kontrol dari dotSpatial dan diprogram dengan aplikasi bahasa pemrograman visual basic. Penelitian ini memiliki tiga tahap proses awal, yaitu pengolahan data spasial, pengolahan data aribut, dan pembuatan aplikasi. Pengolahan data spasial diawali dengan observasi lapangan kemudian melakukan proses digitasi pada denah peta dan dihasilkan peta kios pasar. Pada pengolahan data atribut, data yang diolah ialah data informasi pedagang kios dan data pendukung seperti fasilitas umum dan fasilitas tiap kios, kemudian disusun menjadi basis data. Pembuatan aplikasi dengan melakukan desain pada tampilan aplikasi sehingga sudah terlihat bentuk dari Graphical User Interface (GUI). Kemudian dilakukan integrasi antara data atribut dan data spasial ke dalam aplikasi. Penelitian ini menghasilkan aplikasi berbasis GIS desktop yang mudah digunakan (user friendly) yang bertujuan untuk mempermudah dalam pengeolaan informasi pedagang dan pasar. Kegunaan aplikasi ini antara lain menampilkan data spasial yang terdiri dari kios pasar, fasilitas umum, dan akses jalan. Kemudian menampilkan informasi atribut yang berisi informasi pedagang pasar, informasi kios, dan informasi fasilitas umum. Hasil pengujian aplikasi yang dilakukan pada beberapa responden, antara lain pegawai pasar, pedagang pasar, pengunjung pasar, dan masyarakat umum terbilang cukup memuaskan dengan total nilai baik yaitu 70% pada alur kerja aplikasi dan kemudahan dalam pengoperasian aplikasi, kemudian 80% baik pada informasi yang tersedia di aplikasi, 85% untuk tampilan antar muka aplikasi, dan yang terakhir 90% cukup untuk uji kelayakan aplikasi . Kata Kunci : DotSpatial, Informasi Pedagang, Pasar Bintoro, SIG, Visual Basic","",""
"7","SISTEM INFORMASI PENGOLAHAN DATA PENANGGULANGAN BENCANA PADA KANTOR BADAN PENANGGULANGAN BENCANA DAERAH (BPBD) KABUPATEN PADANG PARIAMAN","Basis Data","Penulis telah mengadakan penelitian pada Kantor Badan Penanggulangan Bencana
Daerah (BPBD) Kabupaten Padang Pariaman dengan tujuan mengetahui sistem informasi
pengolahan data kebencanaan dan selanjutnya mengembangkan sistem yang sedang berjalan
tersebut agar mencapai tingkat yang lebih optimal. Dalam penelitian ini penulis menggunakan
metode penelitian lapangan yaitu dengan mengadakan penelitian langsung ke lapangan,
selanjutnya penulis mengolah hasil data penelitian di labor komputer, kemudian dirancang
suatu sistem informasi pengolahan data bencana, dimana sistem informasi tersebut
menghasilkan informasi berupa laporan – laporan bencana yang terjadi dengan memanfaatkan
sarana komputer sebagai alat bantu dalam pengolahan data. Diharapkan sistem baru yang
penulis kembangkan ini dapat menggantikan sistem lama, agar mencapai tingkat efektifitas dan
efisiensi yang lebih tinggi. Sehingga rancangan tersebut dapat bermanfaat bagi Kantor Badan
Penanggulangan Bencana Daerah (BPBD) Kabupaten Padang Pariaman untuk mendapatkan
laporan dalam pengolahan data kebencanaan yang sangat diperlukan dalam pengambilan
keputusan Pimpinan. Kata kunci : sistem informasi, sistem informasi bencana, Kantor Badan Ketahanan Pangan dan
Penyuluhan Kabupaten Pesisir Selatan","",""
"8","Perancangan dan Penerapan “Search Engine Optimization”(SEO) pada Website Pemasaran Produk Toko Janjebles","Basis Data","Toko Janjebles mengalami kesulitan dalam memasarkan produknya. Solusi yang diberikan adalah membuat website,
namun untuk mengoptimalkan website juga diperlukan teknik tertentu agar web dikenal orang. Namun sayangnya
beberapa Toko Janjebles tidak memahami hal tersebut. Oleh karena itu, penelitian ini akan mengimplementasikan
teknik agar website Janjebles dikenal oleh mesin pencari. Penelitian ini akan mengimplementasikan website berbasis
Search Engine Optimization (SEO) menggunakan teknik On page. Teknik On page dapat dilakukan diantaranya
dengan membuat template yang SEO friendly dan cepat saat diakses, memasang meta tag dan keyword. Analisa
keyword tentang baju Janjebles akan dilakukan agar produk dapat menempati rangking atas dalam pencarian
Google. Hasil dari penelitian ini adalah website Janjebles yang mengimplementasikan SEO On page dengan cara
yang mudah. Penggunaan Content Management System diharapkan dapat membantu pengelola web untuk
mempromosikan produknya dan berakibat pada peningkatan penjualan produk Toko Janjebles tersebut. Kata Kunci: website; pemasaran produk; search engine optimization; on page technique","",""
"9","IMPLEMENTASI SISTEM BASIS DATA UNTUK MENDUKUNG PENGEMBANGAN SISTEM INFORMASI MANAJEMEN SUMBER DAYA MANUSIA (STUDI KASUS  STIKOM DINAMIKA BANGSA)","Basis Data","Penelitian ini merupakan penelitian lanjutan berdasarkan penelitian sebelumnya tentang analisis dan perancangan sistem informasi manajemen SDM yang menghasilkan rancangan basis data dan prototype dari Sistem Informasi Manajemen Sumber Daya Manusia. Penelitian ini terfokus pada implementasi rancangan basis data ke dalam system basis data terintegrasi yang menghubungkan seluruh fungsi-fungsi dalam Manajemen SDM guna mendukung pengembangan Sistem Informasi Manajemen SDM di STIKOM Dinamika Bangsa Jambi. Penelitian ini dilakukan dengan merancang kembali skema database yang akan dikembangkan dengan melakukan penyesuaian terhadap kebutuhan DBMS yang akan digunakan, merancang transaksi-transaksi berdasarkan skema konseptual yang telah dibangun serta melakukan implementasi system basis data dengan menggunakan perintah-perintah DDL (Data Definition Languange) dan DML (Data Manipulation Languange).","",""
"10","PEMBUATAN MODEL SEQUENCE DIAGRAM DENGAN REVERSE ENGINEERING APLIKASI BASIS DATA PADA SMARTPHONE UNTUK MENJAGA KONSISTENSI DESAIN PERANGKAT LUNAK","Basis Data","Konsistensi desain sequence diagram dengan implementasi sering menjadi masalah dalam pembangunan perangkat
lunak, penelitian ini akan menerapkan hasil reverse engineering sequence diagram dari aplikasi yang telah ada sebagai
model dasar untuk membangun perangkat lunak sehingga konsistensi desain sequence diagram bisa dijaga. Dalam
penelitian ini model sequence diagram tersebut dibangun dengan cara mengklasifikasikan interaksi antara pengguna
dengan perangkat lunak di aplikasi basis data pada smartphone. Untuk membuat model UML Sequence Diagram, langkah
pertama adalah memilih dataset berupa source code aplikasi contoh di Blackberry 10 dan kemudian memahami fungsional
aplikasi tersebut. Langkah selanjutnya adalah melakukan reverse engineering dari source code tersebut berdasarkan fitur
yang telah didefinisikan sebelumnya. Lalu dilakukan pembangunan model UML sequence diagram berdasarkan kesamaan
dan pengelompokan pola pada hasil reverse engineering. Langkah terakhir adalah melakukan evaluasi terhadap model
UML sequence diagram dengan cara menggunakannya pada pembangunan aplikasi baru, mengukur tingkat konsistensi
desain sequence diagram serta mengambil pengetahunan dari penerapan studi kasus. Berdasarkan hasil penelitian, model
sequence diagram yang didapatkan dari proses reverse engineering bisa menjaga konsistensi antara desain sequence
diagram dengan implementasi pada pembangunan perangkat lunak. Kata Kunci: Sequence Diagram, Basis Data, Reverse Engineering, Smartphone","",""
"11","ANALISA PERBANDINGAN PEMODELAN BASIS DATA MENGGUNAKAN ER- DIAGRAM DAN EER-DIAGRAM PADA KASUS SISTEM ASISTENSI PERKULIAHAN PRAKTIKUM","Basis Data","Perselisihan dan kebingungan dalam pemilihan dan penentuan alat pemodelan data secara konseptual sering
terjadi apabila tidak memiliki dasar dalam sudut pandang tentang bagaimana penerapan hasil dari pemodelan basis
data. Penerapan hasil rancangan basis data diimplementasikan dengan suatu bahasa pemrograman dengan sudut
pandang berorientasi pada objek dan tidak berorientasi pada objek. Alat perancangan secara konseptual yang
berupa Entity Relationships Diagram (ER-D) dianggap memiliki sudut pandang tidak berorientasi pada objek
sedangkan Enhanced Entity Relationships Diagram (EER-D) memiliki pendekatan-pendekatan berorientasi pada
objek. EER-D merupakan perluasan dari ER-D dengan adanya tambahan fitur berupa generalisasi, spesialisasi dan
kategorisasi. Pada studi kasus sistem asistensi perkuliahan praktikum yang dilakukan dengan pemodelan data
dengan merancang basis data menggunakan ER-D dan EER-D dapat dibandingkan bahwa ER-D memiliki
kelebihan dalam kesederhanaan notasi, sifatnya umum tetapi sulit diimplementasikan pada kasus yang orientasinya
pada objek. EER-D memiliki keunggulan lebih mendekati pada kasus yang ada di lapangan karena berorientasi
pada objek, tetapi karena sifatnya yang harus diselesaikan perkasus memaksa perancangannya lebih rumit dan
harus rinci. Pada studi kasus sistem asistensi mata kuliah praktikum ini hasil skema relasi yang ditransformasikan
dari EER-D lebih banyak dibandingkan dengan menggunakan ER-D. Hasil dari skema relasional ini dapat
diterapkan ke dalam aplikasi sistem manajemen basis data diberubah dulu menjadi struktur tabel yang disimpan
dalam sebuah basis data. Kata kunci: ER-Diagram, EER-Diagram, analisa perbandingan.","",""
"12","ANALISIS DAN PERANCANGAN SISTEM BASIS DATA TERHADAP APLIKASI SCORECARD SYSTEM PADA PT. THE FOREST TRUST  INDONESIA","Basis Data","Perusahaan The Forest Trust Indonesia merupakan perusahan yang bergerak di bidang
kehutanan dan hasil bumi yang meliputi kelapa sawit dan perusahaan pengolahan minyak
kelapa sawit, hutan penghasil kayu, pabrik pengolah kayu, pabrik kertas. Perusahaan ini harus
mampu melihat setiap transaksi yang dilakukan di wilayah Sumatera, Kalimantan dan Papua.
Perusahaan The Forest Trust Indonesia memiliki aplikasi scorecard system untuk mendukung
kinerja karyawan. Oleh karena itu, dibutuhkan database yang mampu menampung data dalam
skala besar yang dapat mendukung kinerja website tersebut. Namun setelah dilakukan
observasi pada perusahaan tersebut, muncul adanya kendala di dalam pemakaian website
perusahaan diantaranya adalah : Lambatnya proses input data scorecard; Proses untuk
menampilkan laporan berupa gambar grafik masih terkendala. Dengan terjadinya kendala
tersebut, penulis mencoba menganalisis basis data dengan observasi kinerja website dan
perancangan basis data dengan tahapan konseptual, logical dan fisikal.Tujuan dari tugas akhir
ini adalah peneliti ingin dapat menganalisis basis data pada perusahaan The Forest Trust
Indonesia. Dan dari hasil penelitian ini hasil yang ingin dicapai adalah solusi untuk membuat
rancangan basis data yang efisien dan stabil untuk mendukung layanan atau operasional kerja
dengan baik. Kata Kunci : Analisis, Perancangan Basis Data, Konseptual, Logical dan Fisikal","",""
"13","MANAJEMEN BASIS DATA SARANA KAMPUS UNIVERSITAS BENGKULU MENGGUNAKAN ALGORITMA A BERBASIS SPASIAL","Basis Data","Penelitian ini bertujuan untuk membangun suatu aplikasi manajemen basis data spasial sarana kampus Universitas Bengkulu berbasis Android dengan mengimplementasikan algoritma A* dalam pencarian rute terpendek. Aplikasi ini dapat digunakan oleh pengguna smartphone Android, untuk memilih sarana apa yang ingin dituju di kampus Universitas Bengkulu berdasarkan kategorinya. Metode pengembangan sistem menggunakan sequential linear dan sebagai alat bantu perancangan sistem menggunakan Unified Modelling Language (UML). Bahasa pemrograman yang digunakan adalah bahasa pemrograman Java dengan Android 2.2 SDK dan IDE Eclipse 3.5 Galileo serta database SQLite untuk manajemen basis data. Hasil penelitian ini yaitu aplikasi manajemen basis data spasial dalam penyebarluasan informasi sarana kampus Universitas Bengkulu untuk mendapatkan hasil jarak terpendek yang diterapkan pada smartphone Android sehinggga mudah dibawa kemana-mana dan dapat menghemat waktu dan biaya.
Kata kunci: Algoritma A*, Android, SQLite, UML, Manajemen Basis Data, IDE Eclipse 3.5","",""
"14","ANALISIS PERBANDINGAN SISTEM DATA POKOK PENDIDIKAN ( DAPODIK ) TINGKAT SMK","Basis Data","Sistem Informasi Data Pokok Pendidikan (Dapodik)
merupakan sistem informasi pengolahan data pendidikan yang
digunakan oleh setiap operator sekolah pendidikan.Tujuan
penelitian ini adalah memberikan gambaran bagaimana sistem
berjalan pada sistem yang telah ada dan memberikan beberapa
usulan untuk penambahan fitur.Dalam analisis data pokok
pendidikan ini penulis menggunakan metode penelitian
deskriptif yaitu mendeskripsikan apa bagaimana sistem berjalan
dan dengan pendekatan secara kualitatif serta teknik
pengumpulan data menggunakan observasi, wawancara, dan
dokumentasi. Hasil penelitian menunjukkan bahwa sistem data
pokok pendidikan tingkat smk yang sedang berjalan sudah
sangat membantu pendataan di sekolah.Penulis juga berharap pengembangan aplikasi dapat memberikan lebih banyak lagi
penambahan fitur dan kegunaan aplikasi tersebut menjadikan
lingkup yang lebih luas lagi. Kata kunci — Data Pokok Pendidikan, Perbandingan Sistem.","",""
"15","APLIKASI PENGOLAHAN DATA STOK MOBIL PADA DEALER XYZ DI TASIKMALAYA","Basis Data","Perkembangan ilmu pengetahuan dan teknologi yang sangat pesat semakin mendorong manusia untuk meningkatkan bahkan menciptakan suatu teknologi baru yang lebih bermanfaat bagi umat manusia. Dealer XYZ merupakan salah satu dealer di Tasikmalaya yang masih menggunakan sistem manual dalam pendataannya, Pengolahan Stok merupakan masalah yang sering terjadi pada Dealer XYZ, Sebuah aplikasi Pengolahan data stok dapat mengatasi masalah tersebut, sehingga pengolahan data bisa lebih efektif dan efisien. Metode penelitian yang digunakan adalah, obsevasi, wawancara dan studi pustaka.
Kata Kunci: Stok,Observasi,Wawancara,Studi Pustaka","",""
"16","IMPLEMENTASI PENGAMANAN BASIS DATA DENGAN TEKNIK ENKRIPSI KRIPTOGRAFI SIMETRIS","Basis Data","Salah satu aspek penting dari pengolahan data adalah masalah keamanan data dan
kerahasiaan data. Data - data yang terdapat dalam suatu sistem pengolahan data diharapkan untuk
mengamankan pihak yang tidak berhak tidak dapat mengaksesnya. Untuk bentuk dikembangkan
keamanan dan kerahasiaan data dengan melakukan menu password pengenkripsian dengan
menggunakan DES yang diharapkan tingkat keamanan data terjamin.
Kata kunci: data, keamanan, kerahasiaan, DES, password,","",""
"17","DESAIN SISTEM MANAJEMEN BASIS DATA ASET TETAP PADA SEKOLAH HIGH SCOPE INDONESIA","Basis Data","Perkembangan teknologi informasi tidak hanya mempengaruhi dunia usaha, tetapi juga bidang - bidang
lain, seperti kesehatan, pendidikan, pemerintahan dan lain-lain. Kemajuan teknologi informasi terutama pada
era informasi berdampak pula terhadap pengelolaan aset tetap dalam suatu entitas
Sekolah HighScope Indonesia merupakan salah satu institusi pendidikan sejak dari Playgroup sampai
SMA yang berada di Jakarta Selatan. Sarana, prasarana, peralatan dan perlengkapan yang dimiliki oleh
Sekolah HighScope Indonesia merupakan aset tetap yang harus dikelola secara optimal dalam menunjang
kegiatan operasional pendidikan di Sekolah HighScope Indonesia.
Pengelolaan aset tetap Sekolah HighScope Indonesia masih dilakukan secara manual sehingga
menimbulkan tidak efisien dan tidak efektifnya dalam monitoring aset tetap.
Tujuan penelitian ini adalah untuk membuat desain sistem manajemen basis data aset tetap. Desain
sistem dengan membuat Data Flow Diagram (DFD) dan Entity Relationship Diagram (ERD).
Diharapkan dengan sistem manajemen basis data dapat menjelaskan semua aktivitas dengan baik
sehingga hasil yang diinginkan sesuai dengan keinginan pengguna dan diharapkan pula dapat meminimalkan
kekurangan dan kelemahan sistem yang ada saat ini.
Kata kunci : Desain, Sistem Informasi, Basis Data, Aset Tetap, Manajemen","",""
"18","DISAIN DATABASE UNTUK PENGELOLAAN DATA KULIAH KERJA NYATA (KKN) PADA INSTITUT AGAMA ISLAM NEGERI (IAIN) BATUSANGKAR","Basis Data","Kuliah Kerja Nyata atau yang lebih sering di singkat dengan KKN adalah salah satu agenda akademik yang setiap tahunnya di selenggarakan oleh Lembaga Penelitian dan Pengabdian Masyarakat (LPPM) di Institut Agama Islam Negeri Batusangkar, setiap tahunnya ada sekitar kurang lebih seribu orang mahasiswa yang akan mengikuti kegiatan ini yang tersebar di seluruh daerah yang ada di Sumatera Barat, dalam hal pengelolaan data mahasiswa peserta KKN di Institut IAIN Batusangkar terdapat beberapa kendala dan kelemahan sistem yang sedang berjalan, pembagian kelompok, penempatan mahasiswa dan dosen pendamping lapangan masih menggunakan aplikasi spread sheet, serta sistem penilaian dengan menggunakan blangko penilaian yang juga di buat menggunakan aplikasi excel, dengan menggunakan cara seperti ini, banyak permasalahan yang mungkin di timbulkan, seperti data mahasiswa yang mengikuti hilang, atau data mahasiswa yang ganda, cara seperti ini juga memungkinkan lembaga pengelola kehilangan informasi-informasi penting ketika salah satu data terhapus. Dengan menciptakan sebuat database yang baik, menggunakan metode Entity Relationship Diagram (ERD), lembaga dapat memiliki suatu gudang data yang baik yang tentunya sesuai dengan kaidah-kaidah database, permasalahan-permasalahan yang di timbulkan selama ini dapat terhidar dari anomali-anomali yang terdapat pada database tersebut.
Kata Kunci: Database, Entity Relationship Diagram, Kuliah Kerja Nyata.","",""
